书籍详情链接,图片链接,书名,书名简述,评分,评价数,出版相关信息,概况,作者,出版社
https://book.douban.com/subject/24828265/,https://img9.doubanio.com/view/subject/s/public/s28100836.jpg,证券分析, ,9.1,114人,本杰明•格雷厄姆 (Benjamin Graham)、戴维•多德 (David L.Dodd) / 巴曙松、陈剑 / 中国人民大学出版社 / 2013-6-1 / CNY 198.90,《证券分析》被誉为投资者的圣经，自1934年出版以来，八十年畅销不衰。市场反复证明，《证券分析》是价值投资的经典之作。《证券分析》第6版是1940年版本的升... ,本杰明•格雷厄姆&戴维•多德,中国人民大学出版社
https://book.douban.com/subject/1024363/,https://img2.doubanio.com/view/subject/s/public/s10119902.jpg,索罗斯,走在股市曲线前面的人,8.0,200人,[美] 乔治·索罗斯、（美）韦恩、（德）科南 / 真如 / 海南出版社 / 1997-11 / 28.00元,本书是德国女记者科南和摩根斯坦利的销售经理韦恩对金融奇才索罗斯的访谈录。索罗斯将其金融投资理论、政治分析、道德反省、社会主张和对往事的回忆交织在一起，娓娓道... ,乔治·索罗斯&韦恩&科南,海南出版社
https://book.douban.com/subject/26415468/,https://img3.doubanio.com/view/subject/s/public/s28268630.jpg,大空头, ,8.4,613人,[美] 迈克尔·刘易斯 / 何正云 / 中信出版集团 / 2015-5 / 49.00元,在《大空头》中，作者充分发挥专业特长，将美国次级抵押贷款*及其衍生品的起源、发展直至演变为金融危机的过程融入有趣的故事当中，将次贷担保债务权证、夹层担保债务... ,迈克尔·刘易斯,中信出版集团
https://book.douban.com/subject/26293878/,https://img9.doubanio.com/view/subject/s/public/s28047705.jpg,非理性繁荣（第二版）, ,8.3,161人,罗伯特 J 希勒 / 李心丹、陈莹 / 中国人民大学出版社 / 2014-1-1 / 48.00元,暂无,罗伯特 J 希勒,中国人民大学出版社
https://book.douban.com/subject/27079023/,https://img2.doubanio.com/view/subject/s/public/s29484701.jpg,投资的直觉：由时间、价格、交易者、买卖盘的四度空间分析建立市场逻辑, ,7.4,19人,[美] 詹姆斯·达尔顿（James F. Dalton）、艾里克·琼斯（Eric T. Jones）、罗伯特·达尔顿（Robert B. Dalton） / 郑磊 / 机械工业出版社 / 2017-7 / 69.00,本书的目标读者是严肃认真的交易员和投资者。书中介绍的四度空间分析法，指出价格与价值永远出现分歧，而只有价格与价值出现分歧，才能让投资者捕捉到价格低于价值的时... ,詹姆斯·达尔顿&艾里克·琼斯&罗伯特·达尔顿,机械工业出版社
https://book.douban.com/subject/35123572/,https://img2.doubanio.com/view/subject/s/public/s33701792.jpg,Python金融数据分析与挖掘实战, ,暂无,少于10人,黄恒秋，张良均，谭立云，莫洁安 著 / 人民邮电出版社 / 2020-1-1 / 49.80元,《Python金融数据分析与挖掘实战》从Python基础入门讲起，到应用Python进行科学计算、数据处理、数据可视化、挖掘建模基础训练，再到利用Pytho... ,黄恒秋，张良均，谭立云，莫洁安 著,人民邮电出版社
https://book.douban.com/subject/25747830/,https://img2.doubanio.com/view/subject/s/public/s27094453.jpg,巴菲特的投资组合(珍藏版), ,7.8,197人,（美）罗伯特•哈格斯特朗 / 江春 / 2013-10 / 35.00,暂无,罗伯特•哈格斯特朗, 
https://book.douban.com/subject/35219831/,https://img1.doubanio.com/view/subject/s/public/s33855089.jpg,预测,经济、周期与市场泡沫,7.8,692人,洪灝 / 中信出版集团股份有限公司 / 2020-10 / 69.00,本书以当前全球面临的百年变局为切入点，对经济和市场周期形成的原因、运行的规律进行了系统研究，对古典主义、新古典主义和凯恩斯主义等宏观经济学理论进行了新的阐述... ,洪灝,中信出版集团股份有限公司
https://book.douban.com/subject/10418552/,https://img1.doubanio.com/view/subject/s/public/s29624998.jpg,The Crisis of Crowding,"Quant Copycats, Ugly Models, and the New Crash Normal",,14人,Ludwig B. Chincarini / Bloomberg Press / 2012-7-31 / USD 40.00,A rare analytical look at the financial crisis using simple analysis  The econ... ,Ludwig B. Chincarini,Bloomberg Press
https://book.douban.com/subject/1255653/,https://img1.doubanio.com/view/subject/s/public/s1234579.jpg,技术分析基础教程, ,,11人,马丁.普林格 / 海南出版社 / 2002-6 / 19.80元,暂无,马丁.普林格,海南出版社
https://book.douban.com/subject/27079036/,https://img9.doubanio.com/view/subject/s/public/s29484714.jpg,憨夺型投资者, ,7.6,128人,[美] 莫尼什·帕伯莱（Monish Pabrai） / 陈丽芳 / 机械工业出版社 / 2017-7 / 39.00,结合巴菲特等投资大师的投资智慧和帕特尔人的商业头脑，帕伯莱列出了憨夺型投资框架，这将帮助所有投资散户和基金经理大大提升自己的投资回报，获得比市场平均水平更高... ,莫尼什·帕伯莱,机械工业出版社
https://book.douban.com/subject/26421631/,https://img1.doubanio.com/view/subject/s/public/s28106438.jpg,估值技术,CFA协会机构投资系列,7.9,21人,CFA 大卫 T. 拉拉比 (David T. Larrabee) / 王晋忠 / 机械工业出版社; 第1版 / 2015-5-1 / 99.00,估值是投资分析的基石，全面理解和正确运用估值方法是长期成功投资的关键。合理应用估值技术，能帮助投资者区分价格和价值，二者的关键区别来自超额收益流。本书由CF... ,CFA 大卫 T. 拉拉比,机械工业出版社
https://book.douban.com/subject/2005378/,https://img2.doubanio.com/view/subject/s/public/s2348082.jpg,股票投资的24堂必修课, ,7.3,339人,威廉·欧奈尔 / 中国青年出版社 / 2007-1 / 39.90元,《股票投资的24堂必修课》是投资者进行股票投资的必读书之一。世界上首屈一指的投资大师威廉·欧尼尔在本书中，通过24堂股票投资必修课，为投资者提供了易于操作、... ,威廉·欧奈尔,中国青年出版社
https://book.douban.com/subject/5921155/,https://img3.doubanio.com/view/subject/s/public/s6277530.jpg,投资大围猎, ,8.1,78人,王晓萌 / 经济管理 / 2011-1 / 38.00元,《投资大围猎:你是猎手还是猎物?》用资产配置的大格局，风趣地揭示了在这场金钱的大围猎中，人们如何摆脱猎物的宿命、突破杀戮重围，成为主宰自己命运的猎手。《投资... ,王晓萌,经济管理
https://book.douban.com/subject/26864004/,https://img9.doubanio.com/view/subject/s/public/s29011536.jpg,择时与选股, ,6.1,43人,[美]拉里·威廉斯（Larry Williams） / 朱振坤、柴毓 / 机械工业出版社 / 2016-8 / 45.00,拉里·威廉斯运用自己娴熟的交易智慧，回顾了200年的美国市场投资交易历史，发现整个市场中的择时与选股的要点，并以简单的语言将左右资本市场未来的因素呈现给读者... ,拉里·威廉斯,机械工业出版社
https://book.douban.com/subject/35492230/,https://img9.doubanio.com/view/subject/s/public/s33921874.jpg,理性的投资者——一个散户对股市的另类思考, ,,14人,,本书从股票的起源和基本属性出发，为读者讲述了价值投资的基本原理。在此基础上，从人性和市场规律角度，讨论了感性的投资艺术，并对企业分析和投资实践做出了具体可行... ,, 
https://book.douban.com/subject/30871356/,https://img3.doubanio.com/f/shire/5522dd1f5b742d1e1394a17f44d590646b63871d/pics/book-default-lpic.gif,成交量核心技术 理财学院,理财学院,暂无,少于10人,金铁 / 中国宇航出版社 / 45元,暂无,金铁,中国宇航出版社
https://book.douban.com/subject/26370440/,https://img9.doubanio.com/view/subject/s/public/s28052336.jpg,擒住大牛,一本书看透股市庄家,6.5,36人,曹明成、谭文 / 立信会计出版社 / 2015-2-1 / CNY 48.00,暂无,曹明成&谭文,立信会计出版社
https://book.douban.com/subject/20429193/,https://img1.doubanio.com/view/subject/s/public/s24503398.jpg,期货投资的艺术,在不确定性中寻找确定性,7.4,187人,黄圣根 / 机械工业出版社 / 2012-12 / 39.00元,从事期货行业20载的资深专家黄圣根，业内人称“黄铜铝”、客户人称“黄market”，从1993年抱定期货这一终身职业以来，始终以兢兢业业、几近痴迷的态度探索... ,黄圣根,机械工业出版社
https://book.douban.com/subject/30229908/,https://img3.doubanio.com/view/subject/s/public/s29775270.jpg,金融街：私募风云, ,6.7,380人,梁成 / 中国友谊出版公司 / 2018-6 / 46.00元,暂无,梁成,中国友谊出版公司
https://book.douban.com/subject/20444567/,https://img9.doubanio.com/view/subject/s/public/s24576016.jpg,华尔街潜规则, ,暂无,少于10人,（美）乔舒亚M·布朗 / 陈丽芳 / 机械工业出版社 / 2013-1 / 42.00元,《华尔街潜规则》赤裸裸地揭露了投资行业的真相。这是乔舒亚——一个资深的华尔街职业经纪人身涉金融投资行业第一线多年积累的经验。他作为洞悉华尔街内幕的人，率先道... ,乔舒亚M·布朗,机械工业出版社
https://book.douban.com/subject/3629464/,https://img9.doubanio.com/view/subject/s/public/s3938194.jpg,跟庄细节, ,7.6,21人,范江京 / 中国宇航 / 2009-4 / 38.00元,《跟庄细节:跟庄获利实战技法》分析了庄家坐庄的原理，庄家坐庄的基本路线和坐庄思路，剖析了庄家操盘的特点，详细讲解了庄家坐庄的整个过程，庄家坐庄操盘各阶段股价... ,范江京,中国宇航
https://book.douban.com/subject/27152790/,https://img1.doubanio.com/view/subject/s/public/s29559798.jpg,投机教父尼德霍夫的股票投机术, ,7.5,30人,[美]维克多·尼德霍夫; [美]劳蕾尔·肯纳 / 张尧然、杨颖玥 / 中国青年出版社 / 2017-10-1 / 59.00,人在做出抉择时，如果不知道每一种选择的未来结果如何，那就是在投机，所以每个人都是投机者。在风险被放大的股票投机游戏中，索罗斯操盘手、投机教父尼德霍夫所信奉与... ,维克多·尼德霍夫; [美]劳蕾尔·肯纳,中国青年出版社
https://book.douban.com/subject/35219867/,https://img1.doubanio.com/view/subject/s/public/s33733587.jpg,订单流交易,了解微观市场结构并从中获利,7.9,35人,迈克・威尔托斯 / 杨云飞 / 地震出版社 / 2020-1 / 198.00元,《订单流交易》是在全球范围内首次印刷出版的订单流相关著作，以作者Michael Valtos20余年的订单流交易实战经验为基础，为中国交易者揭开订单流的神秘... ,迈克・威尔托斯,地震出版社
https://book.douban.com/subject/25733498/,https://img2.doubanio.com/view/subject/s/public/s27064861.jpg,对冲基金经理回忆录（原书第2版）, ,7.9,66人,（美）拉尔斯•克罗耶 / 黄菊、杨睿 / 机械工业出版社 / 2013-10-1 / 39.00,虽然对冲基金行业已经从主要投资于美国资产的小众投资工具，演化至全球万亿美元的投资舞台，但它却依旧不公正地被世人描绘成一个充斥着这各种投机取巧者和麦道夫式骗子... ,拉尔斯•克罗耶,机械工业出版社
https://book.douban.com/subject/1371888/,https://img3.doubanio.com/view/subject/s/public/s2669830.jpg,多空操作秘笈,Stan Weinstein's secrets for Profiting in,8.4,28人,Stan Weinstein / 寰宇財務顧問公司 / 寰宇出版股份有限公司 / 19940301 / NT$ 360,暂无,Stan Weinstein,寰宇出版股份有限公司
https://book.douban.com/subject/24863148/,https://img2.doubanio.com/view/subject/s/public/s26841562.jpg,操盘手Ⅱ,骑士精神,6.1,107人,花荣 / 东方出版社 / 45.00,淘尽黄沙始见金，股市交易史如一条不息的川流，江面的波澜与涟漪，或许更吸引眼球，但是，真正负重致远的，却还在深层厚处。里面的人物，里面的故事，不单单只是吸引，... ,花荣,东方出版社
https://book.douban.com/subject/27064749/,https://img1.doubanio.com/view/subject/s/public/s29470517.jpg,股票大作手回忆录, ,8.7,15人,[美] 埃德温·李费佛 / 何君 / 地震出版社 / 2014-10-1 / 36.00元,华尔街没有新鲜事，因为投机交易像群山一样古老。 ,埃德温·李费佛,地震出版社
https://book.douban.com/subject/5333422/,https://img9.doubanio.com/view/subject/s/public/s4510845.jpg,厚黑操盘学,一个职业股民的制胜之道,7.4,51人,空空道人 / 山西人民出版社 / 2010-10 / 38.00元,网络炒股名家潮起潮落，但是五年来空空道人的炒股博客一直火爆如初，赢得了无数亲身实战股友的疯狂追捧，目前已经累计达到了4 0000万次访问！铁杆空心粉一句“五... ,空空道人,山西人民出版社
https://book.douban.com/subject/1276341/,https://img1.doubanio.com/view/subject/s/public/s2399778.jpg,江恩理论与中国历法, ,暂无,少于10人,常秉义 / 中国社会科学出版社 / 2000-04 / 22.0,暂无,常秉义,中国社会科学出版社
https://book.douban.com/subject/1098167/,https://img1.doubanio.com/view/subject/s/public/s1239449.jpg,巴菲特怎样选择成长股, ,8.0,170人,蒂默西・韦克 / 刘磊 / 中国财政经济出版社 / 2002-5 / 29.80元,这本《巴菲特怎样选择成长股》讲述投资者应该如何沿着巴菲特的足迹，去发现那些价值被低估的股票，去躲开一个已经十分危险的市场。作为价值投资理论的实践者和研究者，... ,蒂默西・韦克,中国财政经济出版社
https://book.douban.com/subject/30505403/,https://img1.doubanio.com/view/subject/s/public/s33784588.jpg,短线交易大师：工具和策略,经过实战检验的对日交易、波段交易和头寸交易都适用的技术,7.2,14人,[美] 奥利弗·瓦莱士、[美] 格雷格·贝尔 / 张丹丹 / 山西出版传媒集团 山西人民出版社 / 2013-12 / 48,《短线交易大师:工具和策略》涵盖了交易者想要持续获利所必需了解的每一件事，阐明了交易者为了成功所必须掌握的心理调控和自我约束能力，以及发现和利用独特的获利机... ,奥利弗·瓦莱士&格雷格·贝尔,山西出版传媒集团 山西人民出版社
https://book.douban.com/subject/10455487/,https://img9.doubanio.com/view/subject/s/public/s8864515.jpg,四维操盘, ,暂无,少于10人,邢孝寒 / 中国宇航 / 2012-1 / 29.80元,《四维操盘:基于价量时空分析的实战操盘技术》内容简介：中国证券市场发展至今，已经过了21载。一个外表成年的市场，其实仍是一个“弱有效市场”。投资者在市场中承... ,邢孝寒,中国宇航
https://book.douban.com/subject/3115456/,https://img2.doubanio.com/view/subject/s/public/s3372523.jpg,价值投资胜经, ,7.7,14人,洛 / 简丰敏 / 2008-5 / 29.00元,《价值投资胜经》内容简介为：华尔街的传奇人物、亿万富翁沃伦•巴菲特的导师本杰明•格兰汉姆所总结的价值投资法是华尔街最为可靠、安全和成功的赚钱之法。 六十多年... ,洛, 
https://book.douban.com/subject/26948036/,https://img9.doubanio.com/view/subject/s/public/s33572855.jpg,小乌龟投资智慧,如何在投资中以弱胜强,7.9,441人,伍治坚 / 电子工业出版社 / 2017-2 / 59.8元,《小乌龟投资智慧》，是一本投资教育普及读本。作者伍治坚希望和广大读者朋友们分享一些作为一个理性的投资者应该学习的必要知识，通过自我教育和提升来武装自己，帮助... ,伍治坚,电子工业出版社
https://book.douban.com/subject/11606474/,https://img9.doubanio.com/view/subject/s/public/s11336935.jpg,股票大作手利弗莫尔谈如何操盘, ,7.7,31人,杰西 L.利弗莫尔 / 陈丽芳 / 机械工业出版社 / 2012-9 / 25.00元,《股票大作手利弗莫尔谈如何操盘》一书披露了利弗莫尔操盘的三大秘诀：把握时机、资金管理和情绪控制。以非常直白的方式首次将利弗莫尔的交易方法和诀窍告知世人。译者... ,杰西 L.利弗莫尔,机械工业出版社
https://book.douban.com/subject/11606475/,https://img1.doubanio.com/view/subject/s/public/s11345387.jpg,股票大作手利弗莫尔回忆录, ,8.6,65人,埃德温·勒菲弗 / 周际樑 / 机械工业出版社 / 2012-9 / 39.80元,《股票大作手利弗莫尔回忆录》是对投资者最有启发的一本经典著作，以小说的形式记述了股票天才杰西•利弗莫尔（1877－1940）（书中化名利文斯顿）的传奇交易人... ,埃德温·勒菲弗,机械工业出版社
https://book.douban.com/subject/11606476/,https://img9.doubanio.com/view/subject/s/public/s11345384.jpg,交易员量价实战技法,交易员量价实战技法,7.3,26人,马克·莱博威特 / 2012-8 / 59.00元,暂无,马克·莱博威特, 
https://book.douban.com/subject/6728143/,https://img2.doubanio.com/view/subject/s/public/s6827841.jpg,抄底,未来十年的六大价值投资领域,7.0,47人,斯科特·菲利普斯 / 王佳艺 / 人民邮电出版社 / 2011-8 / 35.00元,斯科特·菲利普斯的《抄底——未来十年的六大价值投资领域》从美国金融危机产生的根源出发，为读者解析了为何在金融危机的大背景下是进行“抄底”的最好时机，并从那些... ,斯科特·菲利普斯,人民邮电出版社
https://book.douban.com/subject/27009488/,https://img3.doubanio.com/view/subject/s/public/s29414590.jpg,财务自由之路,7年内赚到你的第一个1000万,7.6,4678人,[德] 博多·舍费尔 / 刘欢 / 现代出版社 / 2017-3 / 45.00元,暂无,博多·舍费尔,现代出版社
https://book.douban.com/subject/34439633/,https://img2.doubanio.com/view/subject/s/public/s33302902.jpg,姚尧股市形态学, ,8.4,74人,姚尧 / 海天出版社 / 2019-6 / 108.00元,暂无,姚尧,海天出版社
https://book.douban.com/subject/1221057/,https://img9.doubanio.com/view/subject/s/public/s2740104.jpg,股色股香,一个投资银行家的欲望风景,7.8,239人,胡野碧、萧洪驰 / 团结出版社 / 2005-1-1 / 26.80元,这是我国第一部全方位描写投资银行家及股市一级市场的小说。由于行业的特性，投资银行家拥有广阔的社会视野，他们纵横游说于各路权贵和精英之间，对社会及人性体验的深... ,胡野碧&萧洪驰,团结出版社
https://book.douban.com/subject/10815976/,https://img2.doubanio.com/view/subject/s/public/s25802151.jpg,股权资产估值,CFA考试系列,9.2,62人,美）杰拉尔德E.平托、托马斯R.罗宾逊、伊莱恩•亨利、约翰D.斯托 / 刘醒云 / 机械工业出版社 / 2012-7-1 / 99.00元,作为CFA协会投资系列丛书的一部分，《股权资产估值》是为从金融专业的研究生到执业投资专业人士等广泛的读者设计的。这本与全球相关的指南概述了包括在北美以外交易... ,美]杰拉尔德E.平托&托马斯R.罗宾逊&伊莱恩•亨利&约翰D.斯托,机械工业出版社
https://book.douban.com/subject/6525417/,https://img9.doubanio.com/view/subject/s/public/s6641296.jpg,同花顺炒股软件从入门到精通, ,6.4,17人,龙马金融研究中心 / 人民邮电 / 2011-6 / 79.00元,《同花顺炒股软件从入门到精通(附盘)》，全书分为5篇，共31章。第1篇【入门篇】主要讲解了网上炒股必知、第一次股票买卖、认识同花顺家族、走进同花顺2010标... ,龙马金融研究中心,人民邮电
https://book.douban.com/subject/26728938/,https://img1.doubanio.com/view/subject/s/public/s28426838.jpg,缺口技术分析：让缺口变为股票的盈利, ,6.0,22人,（美）朱丽叶 R. 达尔奎斯特（Julie R. Dahlquist）、小理查德 J. 鲍尔（Richard J. Bauer，JR.） / 史雷 / 机械工业出版社 / 2016-1-15 / 59.00,缺口是指通过价格的跳空高开/低开为我们提供交易机会的信号。然而，直到今天，有关缺口交易的话题仍然只局限于坊间的传闻，而真正以检验研究为基础的理论尚未出现。在... ,朱丽叶 R. 达尔奎斯特&小理查德 J. 鲍尔,机械工业出版社
https://book.douban.com/subject/25911719/,https://img9.doubanio.com/view/subject/s/public/s27309024.jpg,投机之王回忆录, ,7.1,15人,[美]艾德温•拉斐尔著 / 颜诗敏 / 中国人民大学出版社 / 2014-7-5 / 39.80元,杰西•利弗莫尔一生极具传奇色彩，被公认为股票投机史上最伟大的投机者之一。《投机之王回忆录》以其生平为蓝本，借一名化名为拉里•利文斯顿的人物，再现了其跌宕起伏... ,艾德温•拉斐尔著,中国人民大学出版社
https://book.douban.com/subject/30336433/,https://img1.doubanio.com/view/subject/s/public/s29879649.jpg,超级强势股：如何投资小盘价值成长股（典藏版）, ,7.2,15人,肯尼思 L.费雪 / 机械工业出版社 / 2018-10 / 59,暂无,肯尼思 L.费雪,机械工业出版社
https://book.douban.com/subject/26706418/,https://img9.doubanio.com/view/subject/s/public/s28381236.jpg,如何做股票交易, ,7.7,17人,杰西·利弗莫尔 / 汪雪峰 / 2015-7-1,暂无,杰西·利弗莫尔, 
https://book.douban.com/subject/1161717/,https://img1.doubanio.com/view/subject/s/public/s2701977.jpg,炒股就这几招,绝招篇,6.5,77人,李嶂喆 / 中国经济出版社 / 2007-1 / 25.00元,《炒股就这几招》为股市的新华词典，中国股民第一红宝书，任何图书难以与之抗衡。股民亲切地称作者李幛喆为“李几招”。尽管股市有牛有熊，但是该书牛气不断，十几年畅... ,李嶂喆,中国经济出版社
https://book.douban.com/subject/20485545/,https://img1.doubanio.com/view/subject/s/public/s29878508.jpg,复盘+：把经验转化为能力,把经验转化为能力,6.0,235人,邱昭良 / 机械工业出版社 / 2018-9-1 / 59.00,暂无,邱昭良,机械工业出版社
https://book.douban.com/subject/30927352/,https://img3.doubanio.com/f/shire/5522dd1f5b742d1e1394a17f44d590646b63871d/pics/book-default-lpic.gif,股道人心：来自华尔街的股市盈利技巧与策略, ,暂无,少于10人,【美】史蒂夫·中本、向楚材 郁伊堃 译 / 四川人民出版社 / 42元,暂无,史蒂夫·中本&向楚材 郁伊堃 译,四川人民出版社
https://book.douban.com/subject/30882297/,https://img3.doubanio.com/f/shire/5522dd1f5b742d1e1394a17f44d590646b63871d/pics/book-default-lpic.gif,从零开始学K线（白金升级版）, ,暂无,少于10人,22.10元,暂无,22.10元, 
https://book.douban.com/subject/2126561/,https://img9.doubanio.com/view/subject/s/public/s8825935.jpg,行棋无悔, ,6.9,263人,董明珠 / 珠海出版 / 2006-12 / 39.80元,《行棋无悔》详细介绍了从2001年，格力电器公司陆续发生的“滨江事件”、“淮地事件”等前后鲜为人知的故事，以及董明珠如何凭借自身永不言败的精神和怎样依靠格力... ,董明珠,珠海出版
https://book.douban.com/subject/30761470/,https://img1.doubanio.com/view/subject/s/public/s33503738.jpg,寻找百倍医药股, ,7.1,69人,凯恩斯 著 / 中国经济出版社 / 49.8元,暂无,凯恩斯 著,中国经济出版社
https://book.douban.com/subject/2007219/,https://img9.doubanio.com/view/subject/s/public/s5806945.jpg,至尊狐狸, ,6.9,36人,花荣 / 经济管理出版社 / 2007-1 / 35.00元,《至尊狐狸:中国股市精英最优套利战术》是一部专门讲述关于股市投机者修炼武功的技术专著。与其他股市投资技术图书不一样，这是一本涉及股市最佳投资技术的书籍，其中... ,花荣,经济管理出版社
https://book.douban.com/subject/24740362/,https://img9.doubanio.com/view/subject/s/public/s26700504.jpg,巴比伦富翁的秘密, ,8.3,33人,卡拉森 / 闫红菊 / 2013-7 / 29.80元,海报： ,卡拉森, 
https://book.douban.com/subject/24873487/,https://img3.doubanio.com/f/shire/5522dd1f5b742d1e1394a17f44d590646b63871d/pics/book-default-lpic.gif,Profile of a Growth Stock, ,暂无,目前无人,Zieg / Investors Intelligence / 1972-6 / USD 5.00,暂无,Zieg,Investors Intelligence
https://book.douban.com/subject/26798608/,https://img2.doubanio.com/view/subject/s/public/s28738153.jpg,3小时快学期权, ,8.6,254人,上海证券交易所衍生品部 / 格致出版社 / 2016-6 / 25.00元,如果将衍生品比作金融产品中的皇冠，那么期权以其复杂性和策略多变性当之无愧成为这顶皇冠上的明珠，期权在满足投资者更多样化的风险管理和产品设计需求的同时，也具有... ,上海证券交易所衍生品部,格致出版社
https://book.douban.com/subject/3234327/,https://img3.doubanio.com/view/subject/s/public/s5941800.jpg,财务报表分析与证券投资, ,7.9,233人,姜国华 / 北京大学出版社 / 2008-9 / 35.00元,《财务报表分析与证券投资》的出发点，即基于财务报表分析的股票价值评估与投资决策，把读者置身于证券分析师的角色以后，《财务报表分析与证券投资》的内容即围绕这个... ,姜国华,北京大学出版社
https://book.douban.com/subject/5408886/,https://img3.doubanio.com/view/subject/s/public/s4590960.jpg,大空头, ,8.3,2737人,（美）迈克尔•刘易斯 / 何正云 / 中信出版社 / 2011-1 / 42.00元,20年前，迈克尔•刘易斯的成名作《说谎者的扑克牌》被公认为描写20世纪80年代华尔街的“教科书”，对美国商业文化产生了重大的影响。20年后，华尔街翻天覆地的... ,迈克尔•刘易斯,中信出版社
