书籍详情链接,图片链接,书名,书名简述,评分,评价数,出版相关信息,概况,作者,出版社
https://book.douban.com/subject/21966340/,https://img9.doubanio.com/view/subject/s/public/s26599606.jpg,金融心理学, ,7.3,595人,特维德 / 周为群 / 中信出版社 / 2013-4 / 66.00元,暂无,特维德,中信出版社
https://book.douban.com/subject/33392183/,https://img2.doubanio.com/view/subject/s/public/s32277451.jpg,行为金融与投资心理学（原书第6版）, ,7.4,77人,约翰 R. 诺夫辛格 / 郑磊、郑扬洋 / 机械工业出版社 / 2019-4 / 59,暂无,约翰 R. 诺夫辛格,机械工业出版社
https://book.douban.com/subject/23774477/,https://img3.doubanio.com/view/subject/s/public/s26372330.jpg,职业期货交易者, ,7.9,139人,斯坦利·克罗 / 山西人民出版社发行部 / 2013-3 / 39.00元,《职业期货交易者》作者斯坦利·克罗在商品交易史上名扬四海，在很大程度上是因为他在《职业期货交易者》里提到的传奇经历。现实中，他在商品市场获取成功之后，就远离... ,斯坦利·克罗,山西人民出版社
https://book.douban.com/subject/1013378/,https://img1.doubanio.com/view/subject/s/public/s1075088.jpg,证券分析, ,8.8,1887人,本杰明·格雷厄姆、戴维·多德 / 邱巍 / 海南出版社 / 2004-1 / 60.00元,暂无,本杰明·格雷厄姆&戴维·多德,海南出版社
https://book.douban.com/subject/30152388/,https://img9.doubanio.com/view/subject/s/public/s29699524.jpg,非常潛力股（經典新譯版）, ,8.5,30人,菲利普 費雪 / 陳民傑 / 寰宇 / 2016-7-18,暂无,菲利普 費雪,寰宇
https://book.douban.com/subject/30435128/,https://img2.doubanio.com/view/subject/s/public/s33560793.jpg,股票基本面分析清单,精准研判股价的底部与头部,7.7,103人,迈克尔·希恩 (Michael Shearn) / 邵倩 / 中国青年出版社 / 2019-1 / 69.00,本书是一本分析投资行为和投资策略的书籍，作者采用巴菲特“我不是证券分析师，我是企业分析师”的理念，认为投资者若是没有花时间彻底了解所购买的企业，而是依赖于他... ,迈克尔·希恩,中国青年出版社
https://book.douban.com/subject/25849823/,https://img9.doubanio.com/view/subject/s/public/s27242584.jpg,股票作手回忆录（注解版）上, ,9.8,33人,Jon D. Markman / 齊克用 / 2013-10 / NTD 600,暂无,Jon D. Markman, 
https://book.douban.com/subject/26851683/,https://img2.doubanio.com/view/subject/s/public/s28958773.jpg,金融炼金术（精装）, ,8.0,81人,乔治·索罗斯 / 孙忠、候纯 / 海南出版社 / 2016-8 / 68元,1997年的金融风暴，罪魁祸首就是索罗斯。本书以日记形式记录着那些不平常的日日夜夜。同时，我们还能看到，索罗斯不单是一位投资领域的顶尖高手，同时也是一位思想... ,乔治·索罗斯,海南出版社
https://book.douban.com/subject/26013554/,https://img2.doubanio.com/view/subject/s/public/s27498673.jpg,股市怪杰,美国顶级股票交易者访谈录,8.3,57人,杰克·施瓦格 / 董瑞霞 / 2014-4-1 / 49.8,《舵手经典34·股市怪杰：美国顶级股票交易者访谈录（扩展和升级版）》第一版写于1 999年中期，恰处于股市大顶（2000年3月）之前。此后，标普500指数一... ,杰克·施瓦格, 
https://book.douban.com/subject/3725211/,https://img1.doubanio.com/view/subject/s/public/s4212718.jpg,不落俗套的成功,最好的个人投资方法,7.6,362人,大卫·F·斯文森 / 武倩 / 中国青年出版社 / 2009-4-1 / 36.00元,畅销书《机构投资与基金管理的刨新》为机构基金管理提供了一个完整而可靠的模板，它的作者又带来了一本指导个人投资者如何管理财产的好书。在《不落俗套的成功》一书中... ,大卫·F·斯文森,中国青年出版社
https://book.douban.com/subject/3145649/,https://img2.doubanio.com/view/subject/s/public/s3210262.jpg,从亏损到赢利,股票、期货、外汇实战总结,8.0,147人,马博 / 企业管理出版社 / 2008年6月 / 36.00元,本书是作者对十年来从事股票、期货、外汇实战交易的阶段性总结。它不是分析报告，也不是研究报告，而是一本专讲真金白银地下单交易的实战报告。本书根据我的交易日记总... ,马博,企业管理出版社
https://book.douban.com/subject/1292290/,https://img9.doubanio.com/view/subject/s/public/s1311654.jpg,战胜庄家-99新篇章（Defeat Banker）,股市主力操盘手法揭秘,7.3,81人,青木 / 广东经济出版社 / 1999年7月 / 13.8,暂无,青木,广东经济出版社
https://book.douban.com/subject/33401129/,https://img2.doubanio.com/view/subject/s/public/s33818742.jpg,投资最重要的事, ,8.5,1114人,[美]霍华德·马克斯 / 李莉、石继志 / 中信出版社 / 2019-3 / 78元,霍华德 ? 马克斯所写的投资备忘录，备受包括巴菲特在内的全球专业投资者推崇。这本书撷取了投资备忘录中的精华内容，将作者几十年来的投资理念和亲身经历娓娓道来，... ,霍华德·马克斯,中信出版社
https://book.douban.com/subject/1011772/,https://img2.doubanio.com/view/subject/s/public/s1070412.jpg,泥鸽靶,华尔街高等金融实录,8.1,1111人,弗兰克·帕特诺伊 / 邵琰 / 当代中国出版社 / 2004-07 / 28.00元,暂无,弗兰克·帕特诺伊,当代中国出版社
https://book.douban.com/subject/26820679/,https://img9.doubanio.com/view/subject/s/public/s28825385.jpg,股票大作手回忆录, ,8.7,33人,[美]埃德温•勒菲弗 / 江月 / 天津人民出版社 / 2016-6 / 45.00,本书是一本金融投资类经典名著，描述了美国最著名的股票投资人杰西•利弗莫尔波澜壮阔的投资生涯。在本书中，利弗莫尔以利文斯顿的假名，讲述了自己15岁开始接触金融... ,埃德温•勒菲弗,天津人民出版社
https://book.douban.com/subject/33443480/,https://img9.doubanio.com/view/subject/s/public/s32317195.jpg,中国顶级私募访谈录, ,7.2,202人,好买基金研究中心 / 2019-5-1,本书共选取了市场上10位知名的私募基金经理，深入剖析他们优异业绩背后的投资策略和投资思路，客观评价他们的策略的有效性和持续性，同时以原汁原味的对话还原私募基... ,好买基金研究中心, 
https://book.douban.com/subject/4882545/,https://img1.doubanio.com/view/subject/s/public/s6196598.jpg,自律的交易者,形成赢家态度,7.8,172人,马克·道格拉斯 / 张轶 / 地震出版社 / 2010-6 / 36.00元,《自律的交易者》能帮助交易者学会应对市场状况和机会的关键行为。马克·道格拉斯是期货交易者，也是交易动力方面的老师，他总结了自己过去的失败交易经验，并找到了解... ,马克·道格拉斯,地震出版社
https://book.douban.com/subject/6828176/,https://img1.doubanio.com/view/subject/s/public/s8475429.jpg,金融炼金术,投资经典索罗斯荣休纪念版,8.5,628人,乔治·索罗斯 / 孙忠、侯纯 / 海南出版社; / 2011-9 / 32.00元,乔治·索罗斯也许是有史以来知名度最高、最具传奇色彩的金融大师。1993年，他利用欧洲各国在统一汇率机制问题上步调不一致的失误，发动了抛售英镑的投机风潮，迫使... ,乔治·索罗斯,海南出版社
https://book.douban.com/subject/26986687/,https://img9.doubanio.com/view/subject/s/public/s29375704.jpg,利弗莫尔的股票交易方法,量价分析创始人威科夫独家专访股票作手利弗莫尔,5.9,53人,理查德·威科夫、杰西·利弗莫尔 / 肖凤娟 / 中国青年出版社 / 2017-4-1 / 38.00元,暂无,理查德·威科夫&杰西·利弗莫尔,中国青年出版社
https://book.douban.com/subject/3309762/,https://img1.doubanio.com/view/subject/s/public/s3373038.jpg,投机客养成教育,The Education of a Speculator,暂无,少于10人,Victor Niederhoffer / 真如 / 寰宇出版股份有限公司 / 1998年10月 / 340元,成功的交易人是有異於常人的族群，他們的財富不是只靠出色的操作系統和掌握技術指標的能力建立起來的。他們一天廿四小時迅速縱橫於全球市場，遭遇或大或小、形色各異的... ,Victor Niederhoffer,寰宇出版股份有限公司
https://book.douban.com/subject/1831286/,https://img9.doubanio.com/view/subject/s/public/s8907906.jpg,看盘细节,全新的股价走势分析方法,7.3,221人,潘伟君 / 地震出版社（图书选题策划中心） / 2006-1 / 26.00元,《看盘细节》依然探讨如何“猜”股价的走势。由于《看盘细节》主要的切入点是分析即时看盘细节，因此更适合有一定经验和阅历的投资朋友。当然，如果你刚刚进入市场但愿... ,潘伟君,地震出版社
https://book.douban.com/subject/2062546/,https://img9.doubanio.com/view/subject/s/public/s23005665.jpg,世界上最伟大的交易商, ,9.0,190人,杰西·利弗莫尔 / 刘晓天 / 地震出版社北京发行部（原地震出版社） / 2007-4 / 30.00元,杰西·利弗莫尔是一个孤独的人，是一个独立行的人，也是迄今为止最成功的股票交易商之一。本书是他在1940年去世前不久写成的，它向投资者第一次披露了这位沉默寡言... ,杰西·利弗莫尔,地震出版社
https://book.douban.com/subject/1728725/,https://img3.doubanio.com/view/subject/s/public/s1795600.jpg,股市真规则,世界顶级评级机构的投资真经,9.0,1481人,帕特·多尔西 / 中信出版社 / 2006-1 / 38.00元,《股市真规则:世界顶级评级机构的投资真经》主要讲述了公司价值研究、股票估值和投资策略等内容，它将帮助投资者挑选正确的股票、发现好的公司、理解不同行业后面的驱... ,帕特·多尔西,中信出版社
https://book.douban.com/subject/27596528/,https://img9.doubanio.com/view/subject/s/public/s29628055.jpg,富爸爸股票投资从入门到精通/富爸爸财商教育系列, ,7.5,121人,(美)安迪·塔纳|译者:汪天盈 / 四川人民 / 2017-10-01 / 48.0,暂无,安迪·塔纳|译者:汪天盈,四川人民
https://book.douban.com/subject/1534187/,https://img2.doubanio.com/view/subject/s/public/s3881211.jpg,技术交易系统的新概念,股票系统交易投资回报,8.9,40人,威尔斯·威尔德 / 浙江大学 / 1997-10-1 / 30.00,技术分析大师威尔德先生的《技术交易系统新概念》。在国内并未正式出版，而已经被全文收录于《股票系统交易的投资回报》中。　　《股票系统交易的投资回报》一书回答了... ,威尔斯·威尔德,浙江大学
https://book.douban.com/subject/6078732/,https://img1.doubanio.com/view/subject/s/public/s6313747.jpg,价值投资,通往理性投资之路,7.8,98人,詹姆斯·蒙蒂尔 / 刘寅龙 / 机械工业 / 2011-4 / 58.00元,《价值投资:通往理性投资之路》内容简介：在这本价值非凡的新书中，作为一位备受尊重同时也备受争议的价值投资者和行为分析师，詹姆斯·蒙蒂尔告诉我们，价值投资是唯... ,詹姆斯·蒙蒂尔,机械工业
https://book.douban.com/subject/4100374/,https://img2.doubanio.com/view/subject/s/public/s4056501.jpg,大钱,挑选优秀成长股的7条法则,7.3,114人,弗雷德里克·科布里克 / 中信出版社 / 2009-11 / 36.00元,《大钱:挑选优秀成长股的7条法则》内容简介：如果你现在恰好存了些钱，想要在股市回暖之时择机入市；如果你眼看着周围的朋友都在赚钱，不愿承担过大的风险又想分享股... ,弗雷德里克·科布里克,中信出版社
https://book.douban.com/subject/27609482/,https://img1.doubanio.com/view/subject/s/public/s29645128.jpg,中国股市十七年,（1990-2006）,8.9,78人,张志雄 / 新华万屏出版社 / 55.00元,一段作者亲身体验的历史，呕心沥血之作，忠实再现了中国股市的动荡与荒诞，虽然是十年前的往事，今天仍在继续…… ,张志雄,新华万屏出版社
https://book.douban.com/subject/1169986/,https://img9.doubanio.com/view/subject/s/public/s10076465.jpg,股史风云话投资,散户投资正典,7.8,46人,[美]JeremyJ.Sieg / 清华大学 / 2004-01-01 / 50.00元,"股史风云话投资：散户投资正典（第3版），ISBN：9787302085744，作者：（美）席格尔（Siegel,J.J.） 著，何亮宇，杨海峰 译 ",JeremyJ.Sieg,清华大学
https://book.douban.com/subject/26220899/,https://img9.doubanio.com/view/subject/s/public/s27734014.jpg,期权波动率与定价：高级交易策略与技巧,最受欢迎的期权经典必读书 每一位期权交易员都不能错过纳坦恩伯格的,9.0,135人,（美）谢尔登•纳坦恩伯格（Sheldon Natenberg） / 韩冰洁 / 机械工业出版社 / 2014-10 / 100.00,自20世纪80年代末本书第1版出版以来，《期权波动率与定价》已经成为全球活跃期权交易者最广泛阅读的书籍。由于对期权定价原理清楚的解释及对交易策略深入的分析，... ,谢尔登•纳坦恩伯格,机械工业出版社
https://book.douban.com/subject/34883973/,https://img1.doubanio.com/view/subject/s/public/s33516757.jpg,价值投资经典战例之中国恒大, ,8.1,181人,正合奇胜 / 清华大学出版社 / 2019-11 / 99,市场上关于价值投资理念的图书多如牛毛，而讲述大型实战案例的则凤毛麟角。读者即便理解了价值投资理念，在实战中往往也不知如何下手。《价值投资经典战例之中国恒大》... ,正合奇胜,清华大学出版社
https://book.douban.com/subject/1923472/,https://img1.doubanio.com/view/subject/s/public/s26552379.jpg,大投机家, ,8.4,783人,[匈] 安德烈·科斯托拉尼 / 海南出版社 / 2006-1 / 30.00元,暂无,安德烈·科斯托拉尼,海南出版社
https://book.douban.com/subject/1059234/,https://img2.doubanio.com/view/subject/s/public/s10104503.jpg,一个美国资本家的成长,世界首富沃伦・巴菲特传,8.1,471人,罗杰﹒洛文斯坦 / 顾宇杰/等 / 海南出版社 / 2007 / 39.8,巴菲特的成功并非偶然，九岁的他已经知道通过收集瓶盖来了解哪一种品牌的软饮料生意最红火；在为《华盛顿邮报》做报童时，他就考虑过可以依靠增加产品线来获得更大利益... ,罗杰﹒洛文斯坦,海南出版社
https://book.douban.com/subject/21381543/,https://img3.doubanio.com/view/subject/s/public/s26034660.jpg,盘口解读技术, ,8.1,21人,Vadym Graifer / 李书路 / 广东经济出版社有限公司 / 2013-1 / 38.00元,"利用盘口解读技术是透过看似随机的价格／成交量现象,解读精明资金与交易大众的行为差异,并藉以拟订进场与出场策略.盘势判读不同于一般技术分析,其有效性完全不受市... ",Vadym Graifer,广东经济出版社
https://book.douban.com/subject/34992560/,https://img1.doubanio.com/view/subject/s/public/s33593037.jpg,投资策略实战分析（原书第4版·典藏版）, ,6.7,17人,[美]詹姆斯·奥肖内西（James P. O'Shaughnessy） / 马海涌、李闻、高闻酉 / 机械工业出版社 / 2020-3 / 150.00,暂无,詹姆斯·奥肖内西,机械工业出版社
https://book.douban.com/subject/4239794/,https://img1.doubanio.com/view/subject/s/public/s6109327.jpg,巴菲特教你选股, ,7.5,48人,约翰·特雷恩 / 中信 / 2010-1 / 26.00元,《巴菲特教你选股》内容简介：沃伦·巴菲特是目前健在的最成功的投资者——他是唯一一位完全靠投资跻身于《福布斯》400富豪排行榜的人？他小心谨慎地挑选自己看重的... ,约翰·特雷恩,中信
https://book.douban.com/subject/4211981/,https://img2.doubanio.com/view/subject/s/public/s11084271.jpg,投资生存战争,卓越投资者必须知道的51个投资常识,7.0,32人,杰拉尔德·勒伯 / 冯松 / 电子工业出版社 / 2012-4 / 38.00元,《投资生存战争》内容简介：杰拉尔德•勒伯被投资界称为“世界5大证券投资专家”之一，《投资生存战争》是他在华尔街投资一线打拼多年的经验总结。介绍了51种实用的... ,杰拉尔德·勒伯,电子工业出版社
https://book.douban.com/subject/30267836/,https://img9.doubanio.com/view/subject/s/public/s33549534.jpg,滚雪球：巴菲特和他的财富人生·上（畅销版）, ,8.1,89人,[美] 艾丽丝·施罗德 / 覃扬眉 等 / 中信出版社 / 2018-2-1,暂无,艾丽丝·施罗德,中信出版社
https://book.douban.com/subject/35244489/,https://img1.doubanio.com/view/subject/s/public/s33874778.jpg,机构投资的创新之路, ,9.1,29人,大卫·F.史文森 / 中国人民大学出版社 / 2020-11-1 / 98.00元,本书全面、系统地对机构投资者的投资理念、资产配置、组合管理、业绩评估、风险控制等进行了深入研究和探讨，是史文森先生及其团队管理耶鲁大学捐赠基金取得卓越业绩的... ,大卫·F.史文森,中国人民大学出版社
https://book.douban.com/subject/35578318/,https://img3.doubanio.com/view/subject/s/public/s33984220.jpg,小狗钱钱2, ,8.9,24人,[德]博多•舍费尔 / 王一帆、张皓莹、任斌 / 中信出版集团 / 2021-12 / 39.80元,暂无,博多•舍费尔,中信出版集团
https://book.douban.com/subject/24697306/,https://img1.doubanio.com/view/subject/s/public/s26658528.jpg,主力操盘手法揭秘, ,,10人,蒋幸霖 / 2013-4 / 28.00元,《主力操盘手法揭秘》以主力坐庄的操作手法为主线，从零开始，以图文并茂的方式系统地介绍了不同主力在建仓、试盘、沈盘、拉升、出货等阶段所采用的各类不同的操盘手法... ,蒋幸霖, 
https://book.douban.com/subject/5442019/,https://img9.doubanio.com/view/subject/s/public/s6268654.jpg,日本蜡烛图技术A股实战技法, ,8.5,28人,张永彬 / 化学工业 / 2011-2 / 36.00元,《日本蜡烛图技术A股实战技法》内容简介：如何真正做到顺势交易？如何及时发现趋势变化？如何精确把握买卖时机？投资者均可在蜡烛图技术中找到答案。蜡烛图技术又称K... ,张永彬,化学工业
https://book.douban.com/subject/4895204/,https://img3.doubanio.com/view/subject/s/public/s4399340.jpg,股票操盘手回忆录, ,8.7,123人,[美]埃德温·拉斐尔（Edwin Lefevre） / 刘海青 / 法律出版社 / 2010.8 / 38.00元,暂无,埃德温·拉斐尔,法律出版社
https://book.douban.com/subject/2382330/,https://img2.doubanio.com/view/subject/s/public/s5858793.jpg,忠告,来自94年的投资生涯,7.0,148人,罗伊.R.纽佰格 / 王维群 / 上海财经大学出版社 / 2008-1 / 25.00元,《忠告:来自94年的投资生涯》一书，全面记录了罗伊纽伯格这位世纪老人神秘且精彩的人生，用自传的形式活灵活现地向读者介绍了金融业界有关投资技术与战略战术的方方... ,罗伊.R.纽佰格,上海财经大学出版社
https://book.douban.com/subject/3027464/,https://img9.doubanio.com/view/subject/s/public/s2997274.jpg,专业投机原理, ,8.6,1345人,维克托·斯波朗迪 / 机械工业出版社 / 2008-3 / 68.00元,《专业投机原理》系统地反映了世界上最伟大的交易员维克托的投机哲学。因此，除了通常的市场知识外，书中还包含了大量的心理学、经济学、政治学方面的知识，大大开阔了... ,维克托·斯波朗迪,机械工业出版社
https://book.douban.com/subject/25723410/,https://img2.doubanio.com/view/subject/s/public/s27041011.jpg,约翰•邓普顿的投资之道, ,7.6,108人,乔纳森•戴维斯、阿拉斯戴尔•奈恩 / 李翔 / 机械工业出版社 / 2013-9 / 45.00,约翰•邓普顿爵士是20世纪最伟大的投资大师之一，他因开创性的股票投资方法，以及勇于进入他人极少涉足的领域，挖掘廉价股票而闻名于世。而本书全面地解读了邓普顿的... ,乔纳森•戴维斯&阿拉斯戴尔•奈恩,机械工业出版社
https://book.douban.com/subject/33477140/,https://img1.doubanio.com/view/subject/s/public/s32344279.jpg,手把手教你港股打新, ,7.0,182人,葛成恩 / 电子工业出版社 / 2019-7 / 59.80元,暂无,葛成恩,电子工业出版社
https://book.douban.com/subject/26901046/,https://img2.doubanio.com/view/subject/s/public/s29117912.jpg,穿过迷雾,巴菲特投资与经营思想之我见,8.2,426人,任俊杰 / 中国经济出版社 / 2016-10-1 / 68,暂无,任俊杰,中国经济出版社
https://book.douban.com/subject/26858055/,https://img9.doubanio.com/view/subject/s/public/s28985886.jpg,短线交易获利秘诀,窥探令人窒息的自营交易，19位操盘手比别人更快的抢钱策略,6.6,15人,[美] 迈克·贝拉菲奥雷（Mike Bellafiore） / 刘乃达 / 安徽人民出版社 / 2016-8-1 / 58.00元,暂无,迈克·贝拉菲奥雷,安徽人民出版社
https://book.douban.com/subject/35066452/,https://img1.doubanio.com/view/subject/s/public/s34024518.jpg,逆向投资心理学（获奖纪念版）：提高投资收益，从战胜心理误区、控制情绪波动开始, ,暂无,少于10人,,暂无,, 
https://book.douban.com/subject/1289999/,https://img3.doubanio.com/view/subject/s/public/s28935880.jpg,营救华尔街,一群投机天才的崛起与陨落,8.7,226人,罗杰·洛温斯坦 / 孟立慧 / 上海远东出版社 / 2003-1 / 49.80元,对长期资本管理公司所做的一次大盘点：清晰、有趣而且信息丰富。特点是：叙述充满戏剧性；对金融世界的解析非常到位；所涉及的内容又非常复杂。在本书所描述的长期资本... ,罗杰·洛温斯坦,上海远东出版社
https://book.douban.com/subject/1548716/,https://img1.doubanio.com/view/subject/s/public/s9889337.jpg,打败庄家,赌场制胜完全攻略,7.9,214人,博智 / 德宏民族出版社 / 2004-1 / 33.80元,如果您从来不赌，您完全可以不看本书。赌博很简单，只有输赢两种结果，赌博很复杂，很多人想尽各种方法要在赌场赢钱……如果神秘的赌场是您心中想要解开的一个谜，请仔... ,博智,德宏民族出版社
https://book.douban.com/subject/3043970/,https://img1.doubanio.com/view/subject/s/public/s10305249.jpg,漫步华尔街,A Random Walk Down Wall Street,8.4,2133人,麦基尔 / 骆玉鼎、彭晗 / 机械工业出版社 / 2008-4 / 48.00元,《漫步华尔街》(原书第9版)是一部投资经典，同时又是一部与时俱进的畅销书。本书将投资理论与实践水乳交融地结合在一起，由坚实基础理论和空中楼阁理论引出基本面分... ,麦基尔,机械工业出版社
https://book.douban.com/subject/2595481/,https://img2.doubanio.com/view/subject/s/public/s5856082.jpg,华尔街赌局,传奇交易家的实战投机术,7.0,64人,[美]维克多•尼德霍夫、劳雷尔•肯纳 / 中信出版社 / 2008-1 / 46.00元,人在一生中的投资活动中，关键的不在于赚钱与否，重要的是能不能从失败中吸取经验教训。成败的风险只是我们人生体验中的一部分，而在金融市场上，这种风险被放大了，因... ,维克多•尼德霍夫&劳雷尔•肯纳,中信出版社
https://book.douban.com/subject/35494000/,https://img9.doubanio.com/view/subject/s/public/s33934356.jpg,比尔·米勒投资之道, ,6.9,38人,[美] 珍妮特·洛 (Janet Lowe) / 王冠亚 / 机械工业出版社 / 2021-7 / 80.00,本书剖析了比尔·米勒在反思传统价值投资分析方法的基础上，在明显对价值型基金管理人不利的市场环境中，所取得成功的哲学、分析方法及策略，揭示了比尔·米勒保持十余... ,珍妮特·洛,机械工业出版社
https://book.douban.com/subject/27071149/,https://img3.doubanio.com/view/subject/s/public/s29477310.jpg,图解缠论,核心理论推导与实战演示,7.9,23人,陈秋明 / 中国经济出版社 / 2016-7-1 / 48,暂无,陈秋明,中国经济出版社
https://book.douban.com/subject/26802635/,https://img9.doubanio.com/view/subject/s/public/s28754414.jpg,个人投资者交易心理, ,暂无,少于10人,[法] 范·萨普，斯帝恩伯格 / 2015-4,本书从认识自己更适合哪种交易，到如何管理智力、情绪和风险，进一步从心理角度认识交易，帮助投资者训练交易头脑，最后使投资者达到健康的平衡状态，循序渐进地帮助投... ,范·萨普，斯帝恩伯格, 
https://book.douban.com/subject/1088630/,https://img1.doubanio.com/view/subject/s/public/s2524409.jpg,沃伦·巴菲特之路, ,8.8,338人,小罗伯特·G·海格士多姆 / 清华大学出版社 / 2007-5 / 28.00元,通过实例精辟而又详尽地描述了贯穿巴菲特投资生涯的投资哲学、投资策略、公司分析和估价技术，展示了巴菲特投资决策过程中令人神往的所谓“秘密”，书中还收入了贝克夏... ,小罗伯特·G·海格士多姆,清华大学出版社
https://book.douban.com/subject/2122440/,https://img2.doubanio.com/view/subject/s/public/s5828213.jpg,超级金钱,Supermoney,7.8,96人,亚当·史密斯 / 机械工业出版社 / 2007-5 / 32.00元,在《超级金钱》新版中，作者提出了一个新的观点：把20世纪60年代和70年代的情况放到当今的市场也同样适用。书中讲述了美国股票市场投机风潮的一段历史，集中研究... ,亚当·史密斯,机械工业出版社
https://book.douban.com/subject/35582678/,https://img9.doubanio.com/view/subject/s/public/s33989655.jpg,中国私募基金经理风云录, ,7.5,13人,雪球 / 中国经济出版社 / 2021-8-1 / 58,在资本市场，有这么一群投资者，他们历经市场涤荡、风雨洗礼，在“牛”“熊”之间不断摸索，经过多年的投资实践，最终找到了属于自己的投资密钥，开启了辉煌的投资人生... ,雪球,中国经济出版社
