书籍详情链接,图片链接,书名,书名简述,评分,评价数,出版相关信息,概况,作者,出版社
https://book.douban.com/subject/4058628/,https://img1.doubanio.com/view/subject/s/public/s4208707.jpg,交易的三根木头, ,4.8,14人,劳剑勇 / 2009-8 / 38.00元,《交易的三根木头》内容简介：这三根粗大的木头叫：心理控制，交易策略，资金管理。在交易的沼泽地，为了生存下来，不至被吞噬，我们必须时刻把它们背在肩上，放在心里... ,劳剑勇, 
https://book.douban.com/subject/5029373/,https://img1.doubanio.com/view/subject/s/public/s4654578.jpg,格雷厄姆谈投资, ,8.4,66人,[美] 罗德尼·克莱因、戴维·达斯特 / 张岩、李红梅 / 中信出版社 / 2010-8 / 62.00元,《格雷厄姆谈投资(来自价值投资之父的不朽教诲)》讲述了：被誉为价值投资之父的格雷厄姆，一生有不少投资智慧为后人景仰。他卓尔不凡的思想和理论曾经影响和鼓舞了像... ,罗德尼·克莱因&戴维·达斯特,中信出版社
https://book.douban.com/subject/35417074/,https://img1.doubanio.com/view/subject/s/public/s33863208.jpg,趋势跟踪（原书第5版）, ,5.9,16人,[美]迈克尔·W.卡沃尔 / 邓佳佶 / 机械工业出版社 / 2021-3 / 159.00,暂无,迈克尔·W.卡沃尔,机械工业出版社
https://book.douban.com/subject/26977276/,https://img1.doubanio.com/view/subject/s/public/s29351128.jpg,从零开始学筹码分布：短线操盘、盘口分析与A股买卖点实战, ,7.2,28人,杨金 / 人民邮电出版社 / 2017-1 / 45.00元,筹码交易技术是股市博弈中的重要技术手段。为帮助读者快速、系统地掌握这门技术，《从零开始学筹码分布：短线操盘、盘口分析与A股买卖点实战》从技术视角、全局视角、... ,杨金,人民邮电出版社
https://book.douban.com/subject/1053698/,https://img2.doubanio.com/view/subject/s/public/s23739432.jpg,股爷您上坐, ,9.0,60人,王安 / 华艺出版社 / 2000-12 / 19.80,十年前，中国人不谈股票，压根就不知道股票为何物！红红火火的中国股市，在近几年来引起各方资金的争相抢进，一片热闹荣景，对于封闭在资本世界多年的中国大陆而言，要... ,王安,华艺出版社
https://book.douban.com/subject/6984708/,https://img2.doubanio.com/view/subject/s/public/s6998932.jpg,陰陽線詳解,Candlesticks Explained,暂无,少于10人,Martin J. Pring / 黃嘉斌 / 寰宇出版股份有限公司 / 2003-9,暂无,Martin J. Pring,寰宇出版股份有限公司
https://book.douban.com/subject/27153416/,https://img1.doubanio.com/view/subject/s/public/s29834588.jpg,共同基金常识, ,8.2,552人,[美] 约翰·博格（John C. Bogle） / 巴曙松、吴博 等 / 北京联合出版公司 / 2017-8 / 109.90元,◆《共同基金常识》是指数基金教父约翰·博格先生的心血力作，历经市场十年洗礼之后的升级版，堪称投资界的经典必读书。在如今越发复杂的市场环境中，这本著作恰如海中... ,约翰·博格,北京联合出版公司
https://book.douban.com/subject/30547800/,https://img2.doubanio.com/view/subject/s/public/s33474001.jpg,投资心理学（第二版）：股票期货成功交易心理,股票期货成功交易心理,暂无,少于10人,杰克 伯恩斯坦 / 康民 / 山西人民出版社 / 2018-11 / 78,暂无,杰克 伯恩斯坦,山西人民出版社
https://book.douban.com/subject/35159058/,https://img3.doubanio.com/f/shire/5522dd1f5b742d1e1394a17f44d590646b63871d/pics/book-default-lpic.gif,筹码分布：精准捕捉牛股主升浪启涨点, ,暂无,少于10人,,暂无,, 
https://book.douban.com/subject/4232211/,https://img9.doubanio.com/view/subject/s/public/s6106605.jpg,超越技术分析,如何开发和执行一套制胜的交易系统,7.3,113人,图莎尔·钱德 / 罗光海 / 万卷出版公司 / 2010-1 / 55.00元,《超越技术分析:如何开发和执行一套制胜的交易系统》特点：浅显易懂。从技术分析入门到交易系统的开发、执行、评定、升级，对于每个概念与公式都有详细明了的讲解，一... ,图莎尔·钱德,万卷出版公司
https://book.douban.com/subject/26586133/,https://img2.doubanio.com/view/subject/s/public/s28314473.jpg,反直觉投资,巴菲特如何避免股市非理性决策失误,7.0,52人,迈克尔·莫布森 / 刘寅龙 / 广东经济出版社 / 2015-8-1 / 48.00元,暂无,迈克尔·莫布森,广东经济出版社
https://book.douban.com/subject/2145302/,https://img1.doubanio.com/view/subject/s/public/s2596717.jpg,专业投资者选股策略、方法和工具, ,7.7,83人,王成 / 2007-6 / 39.80元,本书首先要告诉你如何从基本面分析一个企业的竞争优势，以及这个优势的持续性，对于普通投资者，不符合竞争优势原剿的企业是坚决不能投资的。       其次，你需... ,王成, 
https://book.douban.com/subject/5412790/,https://img1.doubanio.com/view/subject/s/public/s11274517.jpg,雪球投资, ,7.5,233人,林起 / 经济科学 / 2010-12 / 39.80元,《雪球投资:一个价值投资者的股市札记》分成八篇，我将重点放在“企业分析方法”、 “投资以信仰制胜”、“财务分析”三篇上，所占内容比例会有一半左右，“财务分析... ,林起,经济科学
https://book.douban.com/subject/1071320/,https://img9.doubanio.com/view/subject/s/public/s1056665.jpg,巴菲特,从100元到160亿,7.7,119人,沃伦.巴菲特 / 陈鑫 / 中国财经出版社 / 18.00,本书是由沃伦.巴菲特亲自撰写，美国著名法学教授坎宁安协助整理，讲述了巴菲特创造伯克希尔.哈萨维公司奇迹的一本书。其中不仅仅是他从平民成长为巨富的传奇经历，更... ,沃伦.巴菲特,中国财经出版社
https://book.douban.com/subject/10809861/,https://img2.doubanio.com/view/subject/s/public/s10389792.jpg,走進我的交易室,Come Into My Trading Room:A Complete Guide to Trading,9.0,16人,亞歷山大．艾爾德、Dr. Alexander Elder / 羅耀宗 / 大牌出版 / 2012-6-27 / 450元,暂无,亞歷山大．艾爾德&Dr. Alexander Elder,大牌出版
https://book.douban.com/subject/34872356/,https://img2.doubanio.com/view/subject/s/public/s33747723.jpg,香象渡河龙头战法逻辑探究与案例分析, ,7.1,40人,彭道富 / 上海财经大学出版社 / 2019-10 / 98,趋势是基本面和资金面的合流;是虚拟资本和实业资本的共鸣。虽然趋势本质上是资金的运动，但是资金不会糊涂到随意运动，它总是选择寄生在基本面和题材_上，故此，分析... ,彭道富,上海财经大学出版社
https://book.douban.com/subject/6800429/,https://img2.doubanio.com/view/subject/s/public/s10327322.jpg,按图索骥, ,7.5,23人,约翰·J.墨菲 / 益智 / 上海财经大学出版社 / 2011-7 / 39.00元,《按图索骥:怎样发现股票市场趋势(第2版)》仅选取了那些作者认为最有用的指标，并极力设法使其简单易懂。如果你能读懂图表上的各种趋势线并学会分辨上升和下降，掌... ,约翰·J.墨菲,上海财经大学出版社
https://book.douban.com/subject/35300400/,https://img1.doubanio.com/view/subject/s/public/s33785508.jpg,牛市简史：A股五次大牛市的运行逻辑, ,6.9,31人,王德伦、王亦奕、张日升、李家俊 / 机械工业出版社 / 2021-1 / 69.00,暂无,王德伦&王亦奕&张日升&李家俊,机械工业出版社
https://book.douban.com/subject/26674225/,https://img1.doubanio.com/view/subject/s/public/s28350297.jpg,暴利不会忘记，但你却忘记了,费雪详解300年投资史，教你寻找下一个暴富点,6.6,27人,[美] 肯·费雪、[美] 劳拉·霍夫曼斯 / 刘寅龙 / 广东人民出版社 / 2015-10-1 / 48.00元,暂无,肯·费雪&劳拉·霍夫曼斯,广东人民出版社
https://book.douban.com/subject/2382899/,https://img9.doubanio.com/view/subject/s/public/s2862276.jpg,通向财务自由之路,第2版,8.3,1300人,范·撒普 / 董梅 / 机械工业出版社 / 2008年 / 48.00元,《通向财务自由之路》是一本十分适合投资者的书，它具有极好的系统性，完整地介绍了投资，有助于读者成为一个成熟的投资者，主动驾驭自己的财富。很多人都希望获取战胜... ,范·撒普,机械工业出版社
https://book.douban.com/subject/27159606/,https://img1.doubanio.com/view/subject/s/public/s33719908.jpg,投资学（原书第10版）, ,7.9,148人,滋维·博迪、亚历克斯·凯恩、艾伦J.马库斯 / 汪昌云、张永骥 / 机械工业出版社 / 2017-7 / 129,本书是由三名美国知名学府的著名金融学教授撰写的优秀著作，是美国最好的商学院和管理学院的首选教材，在世界各国都有很大的影响，被广泛使用。最新版进行了大量的更新... ,滋维·博迪&亚历克斯·凯恩&艾伦J.马库斯,机械工业出版社
https://book.douban.com/subject/10462473/,https://img3.doubanio.com/view/subject/s/public/s24552240.jpg,波浪理论经典, ,7.0,88人,拉尔夫·N·艾略特 / 何平林 / 天津社会科学院出版社 / 2012-1 / 38.00元,《波浪理论经典》内容简介：波浪理论，不仅是目前最好的预测工具之一，也是真实记录市场行为的有效工具。它为市场分析提供了严密思考的基础，又对未来市场提出了明确展... ,拉尔夫·N·艾略特,天津社会科学院出版社
https://book.douban.com/subject/3519556/,https://img2.doubanio.com/view/subject/s/public/s3777113.jpg,庄家克星, ,5.8,22人,邵道明 / 2009-1 / 58.00元,《庄家克星:职业操盘手解析坐庄全过程(第2版)》分为庄前准备、建仓、试盘、调整、初升、洗盘、拉升、出货、反弹、砸盘等阶段，深入分析庄家坐庄全过程。《庄家克星... ,邵道明, 
https://book.douban.com/subject/4090683/,https://img3.doubanio.com/view/subject/s/public/s6082960.jpg,黄金游戏,交易靠自己,8.0,92人,占豪 / 2009-9 / 29.00元,《黄金游戏3:交易靠自己》以通俗性、价值性、系统性、现实性、实战性为纲要。笔者之所以将“交易靠自己”作为这本书的副标题，是想告诉读者：“交易是自己的，当然要... ,占豪, 
https://book.douban.com/subject/30424140/,https://img9.doubanio.com/view/subject/s/public/s29980446.jpg,伟大的博弈,华尔街金融帝国的崛起（1653-2019年）,8.0,468人,[美]约翰·S.戈登 (John S. Gordon) / 祁斌 / 中信出版集团股份有限公司 / 2019-2-1 / 98,《伟大的博弈》（第三版）是2019年2月中信出版社出版的图书，作者是约翰·s.戈登，中文版译者为祁斌（经博2002）。该书讲述了以华尔街为代表的美国资本市场... ,约翰·S.戈登,中信出版集团股份有限公司
https://book.douban.com/subject/4189265/,https://img1.doubanio.com/view/subject/s/public/s4312808.jpg,Reminiscences of a Stock Operator,With New Commentary and Insights on the Life and Times of Jesse Livermore,9.5,19人,Edwin Lefèvre、Jon D. Markman / Wiley / 2009-12-21 / USD 39.95,"With new commentary and Insights on the life and times of Jesse Livermore  ""Re... ",Edwin Lefèvre&Jon D. Markman,Wiley
https://book.douban.com/subject/2078435/,https://img3.doubanio.com/view/subject/s/public/s2402580.jpg,我在股市活了下来, ,7.1,109人,尼古拉斯·达瓦斯（Nicolas Darvas） / 机械工业出版社 出版 / 2007-5-1 / 21.00元,本书的作者尼古拉斯·达瓦斯将华尔街比做一座规模远远大于拉斯韦加斯的赌城，其中大大小小的交易所就相当于一家家的赌场。接下来，作者强调了股市是存在风险的地方，很... ,尼古拉斯·达瓦斯,机械工业出版社
https://book.douban.com/subject/4772955/,https://img2.doubanio.com/view/subject/s/public/s4388612.jpg,与天为敌,风险探索传奇(珍藏版),7.6,222人,彼得 L.伯恩斯坦(Bernstein P.L.) / 穆瑞年、吴伟、熊学梅 / 机械工业出版社 / 2010-4-1 / 45.00元,《与天为敌:风险探索传奇(珍藏版)》考察了人类探索风险的艰难历程。风险管理是企业经营、股市投资、金融保险、星际探险等一切行为成功的要素，也使人类奸赌的天性得... ,彼得 L.伯恩斯坦,机械工业出版社
https://book.douban.com/subject/35188914/,https://img3.doubanio.com/view/subject/s/public/s33716660.jpg,价值,我对投资的思考,7.3,7972人,张磊 / 湛庐文化/浙江教育出版社 / 2020-9-2 / 118元,暂无,张磊,浙江教育出版社
https://book.douban.com/subject/3032253/,https://img2.doubanio.com/view/subject/s/public/s6455953.jpg,中国股市传奇人物北大演讲录, ,7.9,34人,谢百三 编 / 北京大学出版社 / 2008-1 / 34.98元,《中国股市传奇人物北大演讲录》作者谢百三，平民金融家杨百万、价值投资大师林园、市场资深人士陈钢、“中国股神”林园、技术分析专家倪勇、基本分析大师X先生、成功... ,谢百三 编,北京大学出版社
https://book.douban.com/subject/26899190/,https://img2.doubanio.com/view/subject/s/public/s29113281.jpg,操盘：千股涨停, ,暂无,少于10人,许枫 / 江苏凤凰文艺出版社 / 2016-8 / 49.80,2015年上万亿资金逐鹿A股市场，各路私募基金迅速扩张，大量的场内场外杠杆交易大行其道。青山投资异军突起，从一个皮包公司在短短半年内一跃成为掌管百亿资金的私... ,许枫,江苏凤凰文艺出版社
https://book.douban.com/subject/6536307/,https://img1.doubanio.com/view/subject/s/public/s6783309.jpg,吾股丰登, ,6.8,31人,严为民 / 上海财大 / 2011-6 / 28.00元,《吾股丰登》非经典因此流畅通俗，非教科书因此无图无表，非传记因此可读可信，是体验所以朴实真切，是心得所以肝胆相照，是善念所以正觉苦行。十六字真言，三十六计对... ,严为民,上海财大
https://book.douban.com/subject/2151543/,https://img9.doubanio.com/view/subject/s/public/s2647906.jpg,与天为敌,风险探索传奇,8.0,399人,伯恩斯坦 / 穆瑞年 / 机械工业出版社 / 2007年6月1日 / 38.00元,暂无,伯恩斯坦,机械工业出版社
https://book.douban.com/subject/26369157/,https://img2.doubanio.com/view/subject/s/public/s28051611.jpg,牛市需冷静,从关灯吃面到年均收益40%+的投资秘笈,6.2,158人,雪球出品 / 中国铁道出版社 / 2015-5-1 / 49.80,在投资路上走过弯路的人的一种激励，更是给那些没有在投资路上走过弯路的人的一次提醒，还有因近期股市走牛而收获颇丰因而得意忘形的人的一次警醒，即使如“关灯吃面：... ,雪球出品,中国铁道出版社
https://book.douban.com/subject/3316877/,https://img2.doubanio.com/view/subject/s/public/s3382123.jpg,超级强势股, ,7.8,104人,肯尼思L.费雪 / 高小红，迟云，钟雄鹰 / 机械工业 / 2009－1－1 / 38.00元,暂无,肯尼思L.费雪,机械工业
https://book.douban.com/subject/30131342/,https://img9.doubanio.com/view/subject/s/public/s29678744.jpg,集中投资,巴菲特和查理·芒格推崇的投资策略,7.3,81人,艾伦·卡尔普·波尼洛 (Allen Carpé Benello)、迈克尔·范·比玛 (Michael van Biema) / 中国青年出版社 / 2017-10-11 / 59,暂无,艾伦·卡尔普·波尼洛&迈克尔·范·比玛,中国青年出版社
https://book.douban.com/subject/35226767/,https://img2.doubanio.com/view/subject/s/public/s33873181.jpg,财报背后的投资秘密,“韭菜”的自我修养,8.0,40人,孙旭龙 / 中国经济出版社 / 2020-10 / 58.00,根据作者多年实践经验，本书分析了上市公司资产负债表、利润表各个科目的常见财务舞弊现象，并总结了通用的识别方法，可以帮助投资者避开大多数财务舞弊陷阱。在部分章... ,孙旭龙,中国经济出版社
https://book.douban.com/subject/34682001/,https://img3.doubanio.com/view/subject/s/public/s33441560.jpg,财报背后的投资机会, ,7.4,21人,蒋豹 / 中国青年出版社 / 58.00,本书专门为零基础的初学者而写，它将帮助初学者循序渐进、轻松自如地掌握财务报表的相关知识，快速入门。以真实企业的财报举例，不拘泥于各项指标分析，使用朴实亲切的... ,蒋豹,中国青年出版社
https://book.douban.com/subject/30784658/,https://img2.doubanio.com/view/subject/s/public/s33449372.jpg,股票大作手操盘术（第二版）, ,暂无,少于10人,[美]杰西·利弗莫尔（Livermore J.） / 何君 / 地震出版社 / 2016-1-1 / 22,暂无,杰西·利弗莫尔,地震出版社
https://book.douban.com/subject/20272284/,https://img9.doubanio.com/view/subject/s/public/s27944865.jpg,行为金融,心理、决策和市场,8.2,35人,露西 F.阿科特 (Lucy F.Ackert)、理查德·迪弗斯 (Richard Deaves) / 机械工业出版社 / 2012-11-1 / 59.00元,行为金融：心理、决策和市场，ISBN：9787111399957，作者：（美）露西 F. 阿科特（Lucy F. Ackert） 等著 ,露西 F.阿科特&理查德·迪弗斯,机械工业出版社
https://book.douban.com/subject/25696794/,https://img2.doubanio.com/view/subject/s/public/s33749723.jpg,穷理查智慧书,中英对照,8.6,150人,本杰明•富兰克林 (Franklin B.) / 王正林、王权 / 中国青年出版社 / 2020-11-1 / CNY 39.9,1732年至1758年，富兰克林以虚构的理查·萨德斯（因此叫“穷理查”）为名发表了一系列年鉴，广受欢迎。富兰克林以穷智者的口吻描绘了关于生活、关于理财和致富... ,本杰明•富兰克林,中国青年出版社
https://book.douban.com/subject/1131678/,https://img3.doubanio.com/view/subject/s/public/s10431130.jpg,招财狐狸, ,6.6,39人,花荣 / 经济管理出版社 / 2004-2 / 35.00元,《招财狐狸:京城私募基金实战揭秘》作者花荣，股市投资如同江湖行走，险了身怀绝技之外，还要有内功作为基础，不少投资者遍寻炒股绝招，也把经典投资理论背得滚瓜烂熟... ,花荣,经济管理出版社
https://book.douban.com/subject/4035744/,https://img1.doubanio.com/view/subject/s/public/s4009468.jpg,股票估值实用指南, ,7.2,72人,加里·格雷 / 张甦伟、杨南超 / 上海财经大学出版社 / 2009-8 / 36.00元,《股票估值实用指南(第2版)》内容简介：华尔街经验老道的投资老手都知道，战胜股票市场的关键之所在。然而，对干资本市场的众多投资人而言，如何找到最具增长潜力的... ,加里·格雷,上海财经大学出版社
https://book.douban.com/subject/30180514/,https://img2.doubanio.com/view/subject/s/public/s29725693.jpg,缠中说禅：教你轻松炒股票, ,暂无,少于10人,鲍迪克 / 人民邮电出版社 / 2018-2 / 49.80元,本书共分为9章，全面解析缠论的精华，包括缠论选股、分型与笔、线段、中枢、级别法则、背驰形态等，在深入解读缠论原文的基础上，增加了对难点的专题解读，着重阐述了... ,鲍迪克,人民邮电出版社
https://book.douban.com/subject/10553922/,https://img1.doubanio.com/view/subject/s/public/s8993118.jpg,做市商,私募背后的大秘密,7.9,101人,成一虫 / 团结出版社 / 2012-3-1 / 28.00元,成一虫编著的《做市商(私募背后的大秘密)》讲述了：李迁从券商辞职后进入私募，研究市场、操作股票，后来发现该公司总经理有“老鼠仓”，他没有揭发。再后来总经理因... ,成一虫,团结出版社
https://book.douban.com/subject/2981039/,https://img1.doubanio.com/view/subject/s/public/s3747937.jpg,富人的秘密, ,暂无,目前无人,财智 / 内蒙古文化 / 2008-1 / 29.80元,《富人的秘密》为你揭开富人的秘密，让你了解富人的财富是怎样创造的。富人与穷人的差别何在？《富人的秘密》将会成为一把钥匙，帮你打开财富之门……世界上没有穷人，... ,财智,内蒙古文化
https://book.douban.com/subject/1159368/,https://img2.doubanio.com/view/subject/s/public/s10425083.jpg,中国股市红宝书,鱼来了,7.5,33人,周密 / 企业管理出版社 / 2004-1 / 16.00元,股市会使一些人赔，但是希望母鸡下蛋要给母鸡食吃，希望鱼儿上钓要投下鱼饵。如果一个人认为这些“小小的投资”都怕失去、无法承受，那么我想这个人一生都无法得到“鸡... ,周密,企业管理出版社
https://book.douban.com/subject/27047091/,https://img2.doubanio.com/view/subject/s/public/s29452993.jpg,掌握赫斯特周期分析,赫斯特独创市场周期分析系统的现代处理方法,暂无,少于10人,(英)克里斯托弗·格拉夫顿 / 付沛 / 华中科技大学出版社 / 2017-4-20 / 88.00元,暂无,克里斯托弗·格拉夫顿,华中科技大学出版社
https://book.douban.com/subject/26786997/,https://img1.doubanio.com/view/subject/s/public/s28718009.jpg,反直觉投资：用价值投资理念在股市掘金,用价值投资理念在股市掘金,8.0,43人,[美]托巴尔斯·E·卡利斯勒 (Tobias E.Carlisle) / 汤光华、汤泰萌、杨庆森 / 人民邮电出版社 / 2015-10-1 / 55.00元,《反直觉投资：用价值投资理念在股市掘金》是一本探讨深度价值投资理念的典藏之作。作者托拜厄斯·E.卡莱斯尔作为金融界的新星，是一位资历丰富的积极型价值投资者。... ,托巴尔斯·E·卡利斯勒,人民邮电出版社
https://book.douban.com/subject/4816056/,https://img1.doubanio.com/view/subject/s/public/s4341728.jpg,The Art of Value Investing,How the World's Best Investors Beat the Market,暂无,少于10人,John Heins、Whitney Tilson / Wiley / 2013-4-29 / USD 45.00,The co-Editor of Value Investor Insight and co-founder of the Value Investing ... ,John Heins&Whitney Tilson,Wiley
https://book.douban.com/subject/35620025/,https://img2.doubanio.com/view/subject/s/public/s34076681.jpg,底层逻辑,看清这个世界的底牌,6.9,942人,刘润 / 机械工业出版社 / 2021-10-9 / 69,暂无,刘润,机械工业出版社
https://book.douban.com/subject/21324988/,https://img9.doubanio.com/view/subject/s/public/s25496345.jpg,有效资产管理, ,8.2,329人,威廉•伯恩斯坦 (William J.Bernste) / 王红夏、张皓晨 / 机械工业出版社 / 2013-1 / 39.00元,威廉J.伯恩斯坦编著的《有效资产管理(华章经典金融投资)》将复杂的资产配置理论归纳为简单、易操作的投资方法，有了这套方法的武装，普通投资者也能构建起一套“迷... ,威廉•伯恩斯坦,机械工业出版社
https://book.douban.com/subject/34864317/,https://img3.doubanio.com/f/shire/5522dd1f5b742d1e1394a17f44d590646b63871d/pics/book-default-lpic.gif,量价关系精讲：从入门到精通/富家益股市精讲系列, ,暂无,少于10人,,暂无,, 
https://book.douban.com/subject/1508545/,https://img3.doubanio.com/view/subject/s/public/s26837430.jpg,直觉交易商 开发你内在的交易智慧 罗伯特.库佩尔, ,7.4,35人,罗伯特.库佩尔 / 清华大学出版社 / 1999-7 / 14.00元,暂无,罗伯特.库佩尔,清华大学出版社
https://book.douban.com/subject/26688706/,https://img2.doubanio.com/view/subject/s/public/s28364213.jpg,灵魂的礼物, ,9.1,89人,[美] 罗伯特•舒华兹 / 彭朋、胡淑琦 / 世界图书出版公司北京公司 / 2016-1-1 / 68.00元,这是一本奇特的关于灵魂觉醒和疗愈的书。这本书谈到了灵魂的计划，意思是我们生命中的重大事件很可能是灵魂投生前就计划好的。我作为编辑引进了这本书，然后请了我的两... ,罗伯特•舒华兹,世界图书出版公司北京公司
https://book.douban.com/subject/3837886/,https://img2.doubanio.com/view/subject/s/public/s3872451.jpg,混沌操作法II,Trading Chaos(Second edition),7.6,27人,Bill Williams、Justine Gregory-Williams / 黃嘉斌 / John Wiley ＆ Sons / 2006年2月 / 450元,《混沌操作法》第二版不只告訴投資人如何預測、辨識與處理即將發生的多頭或空頭行情，並介紹物理學與心理學的最新發現，解釋這些觀念如何運用於金融市場——股票、債券... ,Bill Williams&Justine Gregory-Williams,John Wiley ＆ Sons
https://book.douban.com/subject/26877916/,https://img1.doubanio.com/view/subject/s/public/s29064528.jpg,盲眼钟表匠：生命自然选择的秘密,30周年特别纪念版,8.2,223人,[英] 理查德•道金斯 / 王道还 / 中信出版社 / 2016-10-20 / 68.00元,暂无,理查德•道金斯,中信出版社
https://book.douban.com/subject/1852626/,https://img2.doubanio.com/view/subject/s/public/s1757713.jpg,实现财务自由的安全策略, ,暂无,少于10人,索破 / 吴海峰 / 机械工业出版社 / 2006年06月 / 32.0,所谓财务自由，并不是你拥有大笔的真实倾向财富才能企及，而仅是表示你不用为一份薪水而工作。此书就是帮助你通过投资摆脱工作，获得财务自由，做你自己想做的事情。　... ,索破,机械工业出版社
https://book.douban.com/subject/27063843/,https://img3.doubanio.com/view/subject/s/public/s29469700.jpg,投机之王利弗莫尔合集, ,,11人,李费佛、利弗莫尔 / 中信出版社 / 2016-5-10 / CNY 66.00,暂无,李费佛&利弗莫尔,中信出版社
https://book.douban.com/subject/30600413/,https://img3.doubanio.com/view/subject/s/public/s33575830.jpg,技术交易系统新概念, ,6.6,14人,威尔斯·威尔德 / 山西人民出版社 / 2018-4 / 31.80元,暂无,威尔斯·威尔德,山西人民出版社
https://book.douban.com/subject/35578693/,https://img1.doubanio.com/view/subject/s/public/s33980839.jpg,时间的滋味, ,9.2,88人,严锋 / 百花文艺出版社 / 2021-6 / 58.00,《时间的滋味》是作者严锋创作的散文随笔集，收录了他近些年创作的近三十篇散文随笔，包括《一碗油豆腐粉丝汤》记录了作者在一九七一年随父亲在上海吃到人生中碗油豆腐... ,严锋,百花文艺出版社
