书籍详情链接,图片链接,书名,书名简述,评分,评价数,出版相关信息,概况,作者,用户标签,出版社
https://book.douban.com/subject/25763756/,https://img3.doubanio.com/view/subject/s/public/s27125660.jpg,现代世界体系（四卷本）, ,9.0,174人,[美] 伊曼纽尔·沃勒斯坦 / 郭方、夏继果、顾宁 / 社会科学文献出版社 / 2013-11 / 489.00元,暂无,伊曼纽尔·沃勒斯坦,世界史&历史&沃勒斯坦&社会学&政治学&资本主义&世界历史&政治,社会科学文献出版社
https://book.douban.com/subject/22806583/,https://img2.doubanio.com/view/subject/s/public/s26011763.jpg,国家的常识,政权·地理·文化,8.7,2143人,[美]迈克尔·罗斯金(Michael G. Roskin) / 杨勇、夏维勇 / 世界图书出版公司 / 2013-4 / 68.00元,本书通过运用比较政治学的方法，深入浅出地对世界的部分典型国家进行观察和描述，从中选取了英国、法国、德国、日本、俄罗斯、印度、墨西哥、尼日利亚、伊朗这9个国家... ,迈克尔·罗斯金,政治学&政治&文化&比较政治&社会学&历史&政治理论&经济,世界图书出版公司
https://book.douban.com/subject/2026281/,https://img1.doubanio.com/view/subject/s/public/s2552669.jpg,大棋局,美国的首要地位及其地缘战略,8.7,3541人,兹比格纽·布热津斯基 / 中国国际问题研究所 / 上海人民出版社 / 2007-1 / 23.00元,《东方编译所译丛·大棋局：美国的首要地位及其地缘战略》为东方编译所译丛之一。《东方编译所译丛·大棋局：美国的首要地位及其地缘战略》权威地讲述了冷战后的世界格... ,兹比格纽·布热津斯基,国际关系&国际政治&地缘政治&布热津斯基&政治&美国&政治学&外交,上海人民出版社
https://book.douban.com/subject/26584021/,https://img2.doubanio.com/view/subject/s/public/s28396661.jpg,革命年代, ,9.1,535人,高华 / 广西师范大学出版社 / 2016-3-1 / 98.00,暂无,高华,高华&历史&中国近代史&中国历史&党史&政治学&中国&社科,广西师范大学出版社
https://book.douban.com/subject/3074246/,https://img2.doubanio.com/view/subject/s/public/s7772111.jpg,无政府、国家和乌托邦, ,9.0,587人,[美]罗伯特·诺奇克 / 姚大志 / 中国社会科学出版社 / 2008-4-1 / 33.00元,本书是对当代政治哲学影响最大的外国伦理学名著，为当代自由主义的代表，属于极端自由主义。 全书共分三个部分，包括：自然状态理论，或如何自然地追溯出国家；超越最... ,罗伯特·诺奇克,政治哲学&自由主义&诺齐克&政治学&哲学&乌托邦&政治&伦理学,中国社会科学出版社
https://book.douban.com/subject/33476133/,https://img1.doubanio.com/view/subject/s/public/s33507357.jpg,逃避统治的艺术（修订译本）,东南亚高地的无政府主义历史,8.7,306人,[美] 詹姆斯·C·斯科特 / 王晓毅 / 生活·读书·新知三联书店 / 2019-9 / 58.00元,作者通过东南亚山地的历史指出，国家总是试图将山地的居民集中到平地，从事水稻种植，而山民则通过各种方式来逃避国家的控制。传统的观点将山地的居民看做是落后和野蛮... ,詹姆斯·C·斯科特,人类学&无政府主义&政治学&历史&政治&东南亚&民族&2019,生活·读书·新知三联书店
https://book.douban.com/subject/3431988/,https://img2.doubanio.com/view/subject/s/public/s3576992.jpg,人的境况, ,9.1,1688人,[美] 汉娜·阿伦特 / 王寅丽 / 上海人民出版社 / 2009-01 / 36.00元,这部极具原创性的著作，通过对劳动、工作和行动；权力、暴力和体力；地球和世界，以及财产和财富等诸概念的区分，强调了人在面临现代社会高度科技化、自动化和经济现代... ,汉娜·阿伦特,哲学&汉娜·阿伦特&政治哲学&阿伦特&社会学&政治学&思想&政治,上海人民出版社
https://book.douban.com/subject/35378783/,https://img9.doubanio.com/view/subject/s/public/s33990135.jpg,乔姆斯基精粹, ,8.7,34人,[美]诺姆·乔姆斯基（Noam Chomsky） 著、[美]安东尼·阿诺夫（Anthony Arnove） 编 / 李梅 / 上海人民出版社 / 2021-9-15 / 128.00,暂无,诺姆·乔姆斯基[Noam Chomsky] 著&安东尼·阿诺夫[Anthony Arnove] 编,乔姆斯基&语言学&哲学&政治学&思想史&知识分子&美国&2021,上海人民出版社
https://book.douban.com/subject/30389922/,https://img1.doubanio.com/view/subject/s/public/s30012738.jpg,精神政治学,新自由主义与新权力技术,8.2,1068人,[德] 韩炳哲 / 关玉红 / 中信出版社 / 2019-1 / 35.00元,暂无,韩炳哲,哲学&韩炳哲&新自由主义&政治哲学&政治学&心理学&政治&福柯,中信出版社
https://book.douban.com/subject/6879362/,https://img2.doubanio.com/view/subject/s/public/s33591231.jpg,商君书, ,8.3,799人,石磊 译注 / 中华书局 / 2011-9 / 14.00元,《商君书》是战国时期法家学派的代表作之一是中国家喻户晓的人物商鞅及其后学的著作汇编。该书解决了在当时条件下实行变法的理论基础问题，提出了变法的几大原则，既有... ,石磊 译注,法家&商鞅&历史&政治&政治学&哲学&国学&思想,中华书局
https://book.douban.com/subject/34961780/,https://img9.doubanio.com/view/subject/s/public/s33725705.jpg,宣传（第二版）,观念、话语及其正当化,9.6,319人,刘海龙 / 中国大百科全书出版社 / 2020-1 / 78,本书是宣传概念的历史，也是宣传观念的历史。为了回答什么是宣传、它为什么会存在、大众为什么会容忍宣传等问题，本书追溯了第一次世界大战中宣传概念的产生、美国20... ,刘海龙,传播学&政治学&宣传&刘海龙&政治&传播&新闻出版传播&communication,中国大百科全书出版社
https://book.douban.com/subject/2030855/,https://img9.doubanio.com/view/subject/s/public/s10423476.jpg,弱者的武器,农民反抗的日常形式,8.6,1083人,[美] 詹姆斯·C·斯科特 / 郑广怀、张敏、何江穗 / 译林出版社 / 2007-1 / 29.50元,暂无,詹姆斯·C·斯科特,社会学&人类学&斯科特&政治学&政治社会学&社会运动&社会,译林出版社
https://book.douban.com/subject/5906312/,https://img2.doubanio.com/view/subject/s/public/s4591422.jpg,兴盛与危机,论中国社会超稳定结构,8.7,1660人,金观涛、刘青峰 / 法律出版社 / 2011-1 / 45.00元,作者大胆地将系统整体研究方法运用到历史研究中，从中国封建社会延续两千余年与每两三百年爆发一次大动乱之间的关系入手分析，提出中国社会是一个超稳定系统的假说，并... ,金观涛&刘青峰,历史&金观涛&社会学&社会结构&中国历史&政治学&刘青峰&中国,法律出版社
https://book.douban.com/subject/30312386/,https://img9.doubanio.com/view/subject/s/public/s33561944.jpg,国王的两个身体,中世纪政治神学研究,9.3,136人,[德] 恩斯特·H.坎托洛维奇 / 尹景旺 / 上海社会科学院出版社 / 2020-1 / 188,恩斯特·H.坎托洛维奇（Ernst H. Kantorowicz）是20世纪杰出的中世纪史学家，他深入中世纪追溯了“国王的两个身体”——自然身体和政治身体—... ,恩斯特·H.坎托洛维奇,政治哲学&中世纪&历史&思想史&政治学&政治&新书记,上海社会科学院出版社
https://book.douban.com/subject/26323173/,https://img3.doubanio.com/view/subject/s/public/s28009250.jpg,帝国主义是资本主义的最高阶段, ,9.3,397人,列宁 / 中共中央马克思恩格斯列宁斯大林著作编译局 / 人民出版社 / 2015-1 / 27.00元,列宁在这部著作中，根据马克思主义基本原理，总结了《资本论》问世后半个世纪中资本主义的发展，指明资本主义已经发展到一个新的阶段——帝国主义阶段。列宁把世界资本... ,列宁,列宁&马克思主义&政治学&政治哲学&共产主义&政治&经济&马克思,人民出版社
https://book.douban.com/subject/35641122/,https://img1.doubanio.com/view/subject/s/public/s34028917.jpg,世界的尽头,一场文化冲突的见证之旅,暂无,少于10人,[美] 罗伯特·D.卡普兰 / 吴丽玫 / 南京大学出版社 / 2021-10 / 72.00元,暂无,罗伯特·D.卡普兰,政治学&游记&人类学&历史&随笔&美国&非虚构&社会,南京大学出版社
https://book.douban.com/subject/35523875/,https://img1.doubanio.com/view/subject/s/public/s33967027.jpg,美国生活中的反智主义, ,8.4,113人,[美] 理查德·霍夫施塔特 / 陈欣言 / 后浪丨九州出版社 / 2021-8 / 88.00元,暂无,理查德·霍夫施塔特,社会学&美国&思想史&政治学&文化&教育&宗教&后浪,后浪丨九州出版社
https://book.douban.com/subject/30266625/,https://img1.doubanio.com/view/subject/s/public/s33302767.jpg,理解全球冲突与合作,理论与历史：第十版,9.4,268人,[美]小约瑟夫·奈(Joseph S. Nye Jr.)、[加]戴维·韦尔奇(David A. Welch) / 张小明 / 上海人民出版社 / 2018-8-1 / 78,在这部影响越来越广泛，在西方国际关系教材中独树一帜的教科书中，作者沿古典均势时期、一战、二战、冷战，到冷战后的全球化、信息化的历史脉络，介绍了主要国际关系流... ,小约瑟夫·奈&戴维·韦尔奇,国际关系&国际政治&政治学&政治&教材&科普&近期,上海人民出版社
https://book.douban.com/subject/26598286/,https://img9.doubanio.com/view/subject/s/public/s28390496.jpg,论人与人之间不平等的起因和基础, ,9.0,736人,[法] 卢梭 / 李平沤 / 商务印书馆 / 2015-11 / 20.00,让—雅克·卢梭（1712—1778），十八世纪伟大的启蒙思想家、哲学家、教育家、文学家，民主政论家和浪漫主义文学流派的开创者，启蒙运动代表人物之一。本书是1... ,卢梭,卢梭&哲学&政治哲学&社会学&法国&政治学&社会&政治,商务印书馆
https://book.douban.com/subject/3268873/,https://img2.doubanio.com/view/subject/s/public/s6339893.jpg,中国官僚政治研究,中国官僚政治之经济的历史的解析,8.9,247人,王亚南 / 中国社会科学出版社 / 1981-6 / 0.77元,暂无,王亚南,政治学&政治&中国&历史&社会&经典&（旧版）,中国社会科学出版社
https://book.douban.com/subject/35653931/,https://img2.doubanio.com/view/subject/s/public/s34051602.jpg,政治学为什么重要, ,9.5,21人,[英]安德鲁·甘布尔 / 孔新峰 / 北京大学出版社 / 2021-11 / 49.00,本书是甘布尔教授多年来思考政治、研究政治、教授政治及体验政治的产物。在书中，甘布尔教授将“政治学为什么重要”这一中心问题拆解为四个子问题：为什么要劳心于政治... ,安德鲁·甘布尔,政治学&入门&趣味&英国&经典&科普&思维,北京大学出版社
https://book.douban.com/subject/26634998/,https://img1.doubanio.com/view/subject/s/public/s28597697.jpg,政治学说史(套装共2册), ,9.5,59人,[美] 乔治·萨拜因、托马斯·索尔森 / 上海人民出版社 / 2015-9-1 / CNY 148.00,暂无,乔治·萨拜因&托马斯·索尔森,政治学&思想史&政治哲学&政治&历史&社科&经典&书单,上海人民出版社
https://book.douban.com/subject/19952165/,https://img1.doubanio.com/view/subject/s/public/s26032279.jpg,马克思恩格斯选集, ,9.6,271人,[德] 卡尔·马克思、[德国] 弗里德里希·恩格斯 / 中央编译局 / 人民出版社 / 2012-9 / 330.00元,中文第三版，根据十卷本《马克思恩格斯文集》修订，选文篇目经典、篇幅适宜、译文准确、格式考究。 ,卡尔·马克思&弗里德里希·恩格斯,马克思主义&马克思&哲学&政治经济学&恩格斯&西方哲学&政治学&经典,人民出版社
https://book.douban.com/subject/35081726/,https://img2.doubanio.com/view/subject/s/public/s33728752.jpg,自由主义被遗忘的历史,从古罗马到21世纪,8.7,432人,[美]海伦娜·罗森布拉特 / 徐曦白 / 社会科学文献出版社 / 2020-10-1 / 65.00,暂无,海伦娜·罗森布拉特,自由主义&政治哲学&政治学&思想史&哲学&社科&政治&西方哲学,社会科学文献出版社
https://book.douban.com/subject/27119176/,https://img9.doubanio.com/view/subject/s/public/s32299886.jpg,政治与历史,从马基雅维利到马克思（1955-1972年高等师范学校讲义）,9.3,214人,[法] 路易·阿尔都塞 / 吴子枫 / 西北大学出版社 / 2018-1 / 116.00元,本书既是阿尔都塞在巴黎高师开设的哲学史课程的讲义，也是一份卓绝的理论工作的珍贵记录。通过讲授从马基雅维利、霍布斯、18世纪法国哲学与政治、黑格尔、直到马克思... ,路易·阿尔都塞,政治哲学&阿尔都塞&政治学&马克思主义&哲学&社会学&政治&历史,西北大学出版社
https://book.douban.com/subject/25933193/,https://img9.doubanio.com/view/subject/s/public/s27814286.jpg,大国政治的悲剧, ,9.2,143人,[美] 约翰·米尔斯海默 / 王义桅、唐小松 / 上海人民出版社 / 2014-9-1 / 58,如果说保罗·肯尼迪的《大国的兴衰》是为大国的兴衰寻找历史规律，得出了美国必然衰落的悲观结论，那么《大国政治的悲剧》则在探讨大国关系悲剧性的历史根源基础上开出... ,约翰·米尔斯海默,国际关系&国际政治&政治学&政治&国际关系理论&中美关系&现实主义&历史,上海人民出版社
https://book.douban.com/subject/35660743/,https://img1.doubanio.com/view/subject/s/public/s34051137.jpg,第三帝国的生与死, ,9.2,25人,[美] 彼得·弗里切 / 扈喜林 / 社会科学文献出版社 / 2021-12 / 79.00,暂无,彼得·弗里切,历史&德国&二战&德国研究&政治学&甲骨文&历史文化&历史与记忆,社会科学文献出版社
https://book.douban.com/subject/27010229/,https://img9.doubanio.com/view/subject/s/public/s29415534.jpg,通向奴役之路, ,8.9,512人,[英] 哈耶克 / 滕維藻、朱宗風、張楚勇 審定 / 商務印書館(香港)有限公司 / 2017-3-20 / HK$ 128.00,《通向奴役的道路》一书在哈耶克的学术生涯中占有极其重要地位，这本书为他赢得广泛的注意，他的世界性声誉就是由此奠定的。他在这本书中论证道，当时正在计划中的福利... ,哈耶克,哈耶克&自由主义&政治哲学&经济学&政治学&人文社科&西方哲学&经济,商務印書館(香港)有限公司
https://book.douban.com/subject/1877291/,https://img2.doubanio.com/view/subject/s/public/s6278741.jpg,论出版自由,阿留帕几底卡,8.5,2129人,[英] 约翰·弥尔顿 / 吴之椿 / 商务印书馆 / 1958 / 0.28,《论出版自由》作者约翰·弥尔顿（1608-1674）是英国伟大的诗人和政论家，17世纪英国资产阶级革命的参加者。《论出版自由》是弥尔顿许多精心撰述的政论中最... ,约翰·弥尔顿,自由主义&新闻&传播学&政治&政治学&传媒&英国&传播,商务印书馆
https://book.douban.com/subject/6006691/,https://img3.doubanio.com/view/subject/s/public/s29773240.jpg,现代性与大屠杀, ,8.8,1432人,[英] 齐格蒙·鲍曼 / 杨渝东、史建华 / 译林出版社 / 2011-1 / 28.00元,暂无,齐格蒙·鲍曼,社会学&现代性&哲学&鲍曼&批判理论&政治学、人类学与社会科学&社会&政治学,译林出版社
https://book.douban.com/subject/34826156/,https://img3.doubanio.com/view/subject/s/public/s33488550.jpg,经济与社会（第二卷）,上下册,9.8,70人,[德] 马克斯·韦伯 / 阎克文 / 上海人民出版社 / 2020-1-1 / 128.00元,暂无,马克斯·韦伯,社会学&马克斯·韦伯&政治学&社科&韦伯&历史&社会&***世纪文景***,上海人民出版社
https://book.douban.com/subject/26718544/,https://img2.doubanio.com/view/subject/s/public/s29344703.jpg,世俗时代, ,9.3,227人,[加拿大] 查尔斯·泰勒 / 英译：张容南、盛韵、刘擎、张双利、王新生、徐志跃、法译：崇明 / 上海三联书店 / 2016-12 / 158.00元,生活在世俗时代意味着什么？几乎所有人（至少是西方人）都会同意我们活在世俗时代。而且在过去几个世纪，宗教在社会中的地位发生了显著而深刻的变化。在这本对于我们的... ,查尔斯·泰勒,查尔斯·泰勒&社会学&哲学&政治哲学&思想史&宗教&社会史&政治学,上海三联书店
https://book.douban.com/subject/1427824/,https://img1.doubanio.com/view/subject/s/public/s1441537.jpg,无政府、国家与乌托邦, ,8.8,331人,[美]罗伯特·诺齐克 / 何怀宏 / 中国社会科学出版社 / 1991-09-01 / 6.75,本书作者诺奇克1938年11月16日出生于纽约的布鲁克林。他很早就对哲学产生了浓厚的兴趣，在1963年于普林斯顿大学获得博士学位后，曾在普林斯顿大学和洛克菲... ,罗伯特·诺齐克,政治哲学&诺齐克&自由主义&哲学&政治学&政治&乌托邦&伦理学,中国社会科学出版社
https://book.douban.com/subject/1091964/,https://img2.doubanio.com/view/subject/s/public/s1078642.jpg,路易·波拿巴的雾月十八日, ,9.2,1594人,马克思 / 中共中央马克思恩格斯列宁斯大林著作编译局 / 人民出版社 / 2001-9 / 9.50元,《路易·波拿巴的雾月十八日》是马克思针对1851年12月2日路易·波拿巴的政变而撰写的一部评述法国政局的著作。 ,马克思,马克思&历史&马克思主义&政治学&社会学&政治&哲学&政治哲学,人民出版社
https://book.douban.com/subject/30206893/,https://img3.doubanio.com/view/subject/s/public/s33632790.jpg,中国历代政治得失, ,9.5,1039人,钱穆 / 生活·读书·新知三联书店 / 2018-10 / 49.00元,《中国历代政治得失》为作者的专题演讲合集，分别就中国汉、唐、宋、明、清五代的政府组织、百官职权、考试监察、财经赋税、兵役义务等种种政治制度作了提要勾玄的概观... ,钱穆,历史&钱穆&中国历史&政治&中国历代政治得失&政治学&中国&三联书店,生活·读书·新知三联书店
https://book.douban.com/subject/30272669/,https://img3.doubanio.com/view/subject/s/public/s33616620.jpg,威权式法治,新加坡的立法、话语与正当性,8.8,440人,[新加坡] 约西·拉贾 / 陈林林 / 浙江大学出版社 / 2019-7 / 78,本书指出，新加坡缔造了一种匪夷所思的威权式法治。作者展示了作为法治以及自由民主之基石的制度和程序，是通过何种方式成为了制约异己、保护当政者的工具，但同时又无... ,约西·拉贾,威权主义&政治学&新加坡&政治&法学&法理学&比较政治学&法律,浙江大学出版社
https://book.douban.com/subject/1454687/,https://img1.doubanio.com/view/subject/s/public/s8887038.jpg,政府论（下篇）, ,9.0,3650人,[英] 洛克 / 叶启芳、瞿菊农 / 商务印书馆 / 1964-2 / 13.00元,作者约翰·洛克（1632—1704），英国伟大的思想家、哲学家，他对后世政治哲学的发展产生了巨大影响，被视为启蒙时代最具影响力的思想家和自由主义者。《政府论... ,洛克,洛克&政治哲学&政治学&政治&自由主义&哲学&英国&汉译世界学术名著丛书,商务印书馆
https://book.douban.com/subject/35003679/,https://img1.doubanio.com/view/subject/s/public/s33711248.jpg,“民主”与“爱国”,战后日本的民族主义与公共性,9.2,172人,[日] 小熊英二 / 黄大慧 等 / 社会科学文献出版社 / 2020-8 / 198,本书考察了战后日本关于民族主义和公共性的论说，梳理了其从战败到1970年代初的变迁。所用史料涵盖了日本战后主要政治学者、政治党派、政治运动的观点，不仅探讨了... ,小熊英二,日本&民族主义&政治学&日本史&社会学&历史&日本研究&日本政治,社会科学文献出版社
