书籍详情链接,图片链接,书名,书名简述,评分,评价数,出版相关信息,概况,作者,用户标签,出版社
https://book.douban.com/subject/33380604/,https://img9.doubanio.com/view/subject/s/public/s32331195.jpg,国家的视角,那些试图改善人类状况的项目是如何失败的,8.4,691人,[美]詹姆斯·C.斯科特 / 王晓毅 / 社会科学文献出版社 / 2019-5 / 98.00,在这部内容丰富且极具原创性的著作中，詹姆斯•C. 斯科特分析了在各个领域中，由国家主导的大型规划项目遭遇失败的例子。斯科特指出，当国家权力坚持推行简单的规划... ,詹姆斯·C.斯科特,社会学&政治学&政治&经济学&社科&社会&*北京·社会科学文献出版社*,社会科学文献出版社
https://book.douban.com/subject/25947310/,https://img9.doubanio.com/view/subject/s/public/s27980336.jpg,21世纪资本论, ,7.8,3586人,[法] 托马斯·皮凯蒂（Thomas Piketty） / 巴曙松 / 中信出版社 / 2014-9 / 98.00元,《二十一世纪资本论》对自18世纪工业革命至今的财富分配数据进行分析，认为不加制约的资本主义导致了财富不平等的加剧，自由市场经济并不能完全解决财富分配不平等的... ,托马斯·皮凯蒂,经济学&政治经济学&21世纪资本论&经济&社会学&社会科学&政治学&法国,中信出版社
https://book.douban.com/subject/35573644/,https://img2.doubanio.com/view/subject/s/public/s33976932.jpg,政治修辞,西方宣传话语的哲学批判,8.0,17人,[美] 贾森·斯坦利 / 李晓梅、刘易平 / 格致出版社 / 2021-8-1 / 85.00元,暂无,贾森·斯坦利,政治学&传播学&哲学&社会学&语言学&宣传&美国&文化,格致出版社
https://book.douban.com/subject/4220193/,https://img9.doubanio.com/view/subject/s/public/s6768086.jpg,治理中国,从革命到改革,8.6,1113人,[美] 李侃如 / 胡国成、赵梅 / 中国社会科学出版社 / 2010-1 / 45.00元,《治理中国:从革命到改革》是作者30多年来研究中国成果的结晶。它主要从四个方面对中国社会变革、政府管理体系、经济发展，以及中国社会目前所面临的挑战等问题进行... ,李侃如,政治学&海外中国研究&政治&中国研究&中国&社会学&中国问题&历史,中国社会科学出版社
https://book.douban.com/subject/1247769/,https://img2.doubanio.com/view/subject/s/public/s2133573.jpg,家庭、私有制和国家的起源, ,9.0,3836人,恩格斯 / 人民出版社 / 2003-5-1 / 12.00元,自《马克思恩格斯全集》、《列宁全集》、《马克思恩格斯选集》、《列宁选集》问世以来，广大读者迫切要求出版马列著作的单行本。这反映了他们学习马克思列宁主义的强烈... ,恩格斯,社会学&恩格斯&人类学&马克思主义&哲学&马克思主义哲学&政治学&社会,人民出版社
https://book.douban.com/subject/27661640/,https://img9.doubanio.com/view/subject/s/public/s29750296.jpg,现代政治的思想与行动, ,9.4,411人,[日] 丸山真男 / 陈力卫 / 商务印书馆 / 2018-3 / 58.00,《现代政治的思想与行动》是日本著名政治思想史学者丸山真男的代表著作之一，收录了作者自第二次世界大战结束之后约十年间发表的有关政治学及现代政治问题的主要论文。... ,丸山真男,政治学&丸山真男&日本&思想史&日本研究&政治&历史&政治哲学,商务印书馆
https://book.douban.com/subject/35600407/,https://img2.doubanio.com/view/subject/s/public/s34006262.jpg,商贸与文明,现代世界的诞生,8.1,180人,张笑宇 / 一頁folio | 广西师范大学出版社 / 2021-10-10 / 98.00,暂无,张笑宇,历史&文明史&世界史&商业&社会科学&历史学&政治学&文明,一頁folio | 广西师范大学出版社
https://book.douban.com/subject/6895949/,https://img1.doubanio.com/view/subject/s/public/s6974707.jpg,联合政府与一党训政,1944～1946年间国共政争,9.3,1683人,邓野 / 社会科学文献出版社 / 2011-11 / 58.00元,1944—1946年间，国共两党关于联合政府与一党训政的争论，是两种对立的国家政体的争论，是争取一个怎么样的抗战结果的争论，因而也是国共两党政治对立全部历史... ,邓野,历史&中国近代史&近代史&政治&政治学&中国&民国&社会科学文献出版社,社会科学文献出版社
https://book.douban.com/subject/26712445/,https://img9.doubanio.com/view/subject/s/public/s33958034.jpg,西方政治传统,近代自由主义之发展,8.9,471人,[美]弗雷德里克·沃特金斯 / 李丰斌 / 理想国 | 广西师范大学出版社 / 2021-8 / 68,暂无,弗雷德里克·沃特金斯,政治学&自由主义&政治哲学&政治&思想史&理想国&历史&文化,理想国 | 广西师范大学出版社
https://book.douban.com/subject/26716508/,https://img2.doubanio.com/view/subject/s/public/s28569362.jpg,国家与革命, ,9.3,799人,列宁 / 中共中央马恩列斯著作编译局 / 人民出版社 / 2015-12 / 35.00元,暂无,列宁,马克思主义&列宁&政治学&政治&哲学&革命&苏联&理论,人民出版社
https://book.douban.com/subject/2280161/,https://img9.doubanio.com/view/subject/s/public/s5770815.jpg,小镇喧嚣,一个乡镇政治运作的演绎与阐释,9.0,708人,吴毅 / 生活·读书·新知三联书店 / 2007-10 / 42.00元,本书讲述的华中地区某乡镇基层政权、村级组织和农民在复杂的互动结构中博弈共生的过程和状况，为读者提供了新颖而富启发性的视角，是一部有一定思想冲击力的学术著作。... ,吴毅,社会学&农村&田野调查&政治学&社会&中国&政治&中国研究,生活·读书·新知三联书店
https://book.douban.com/subject/34879976/,https://img1.doubanio.com/view/subject/s/public/s33615858.jpg,什么是民粹主义？, ,8.0,2718人,[德]扬—维尔纳·米勒（Jan-Werner Müller） / 钱静远 / 译林出版社 / 2020-5 / 49.00元,暂无,扬—维尔纳·米勒,民粹主义&政治学&社会学&政治社会学&政治&社科&历史&比较政治,译林出版社
https://book.douban.com/subject/35578740/,https://img9.doubanio.com/view/subject/s/public/s34012716.jpg,中国的选择,中美博弈与战略抉择,7.7,254人,[新加坡]马凯硕 / 全球化智库 / 中信出版集团 / 2021-9 / 68.00元,暂无,马凯硕,国际关系&中国&政治&中国研究&政治学&新加坡&美国&经济,中信出版集团
https://book.douban.com/subject/25750468/,https://img9.doubanio.com/view/subject/s/public/s27100954.jpg,中国现代国家的起源, ,8.6,3727人,[美] 孔飞力 / 陈兼、陈之宏 / 生活·读书·新知三联书店 / 2013-10 / 35.00元,孔飞力以政治参与、政治竞争、政治控制为主轴，将中国现代国家形成与发展的“根本性议程”归结为三组相互关联的问题或矛盾：政治参与的扩展与国家权力加强之间的矛盾（... ,孔飞力,孔飞力&历史&海外中国研究&中国近代史&政治学&社会学&中国&近代史,生活·读书·新知三联书店
https://book.douban.com/subject/11229072/,https://img1.doubanio.com/view/subject/s/public/s11313518.jpg,中国历代政治得失, ,9.4,7438人,钱穆 / 生活·读书·新知三联书店 / 2012-7 / 24.00元,本书为作者的专题演讲合集，分别就中国汉、唐、宋、明、清五代的政治组织、百官职权、考试监察、财经赋税、兵役义务等种种政治制度作了提要钩玄的概观与比照，叙述因革... ,钱穆,历史&钱穆&政治制度史&政治&中国历史&中国古代史&中国&经典,生活·读书·新知三联书店
https://book.douban.com/subject/10456130/,https://img9.doubanio.com/view/subject/s/public/s27033416.jpg,社会与政治运动讲义（第二版）, ,9.5,1094人,赵鼎新 / 社会科学文献出版社 / 2012-1 / 45.00元,对于社会运动、政治运动以及革命的研究在国内一直未见专著。本书可以弥补这一空白。本书对社会运动与革命进行了界定并评述了其研究方法，综合论述了西方社会运动和革命... ,赵鼎新,社会学&政治学&赵鼎新&社会运动&政治社会学&社会学/人类学&政治&方法论,社会科学文献出版社
https://book.douban.com/subject/1056867/,https://img1.doubanio.com/view/subject/s/public/s6499098.jpg,政治学, ,9.1,1763人,（古希腊）亚里士多德 / 吴寿彭 / 商务印书馆 / 1965-8-1 / 34.00元,《政治学》是作者亚里士多德的“关于政体研究的专著”，具有多方面的学术价值，对于了解当时希腊社会的状况，了解古希腊人的政治、法律、伦理、教育思想，研究亚里士多... ,亚里士多德,亚里士多德&政治学&政治哲学&哲学&古希腊&政治&经典&商务印书馆,商务印书馆
https://book.douban.com/subject/30353287/,https://img3.doubanio.com/view/subject/s/public/s29897220.jpg,理想国, ,9.5,487人,柏拉图 / 郭斌和、张竹明 / 商务印书馆 / 2018-10 / 56,《理想国》是柏拉图的一篇重要对话录，涉及柏拉图思想体系的各个方面，包括哲学、伦理、教育、文艺、政治等内容，主要的是探讨理想国家的问题。对话录里柏拉图以苏格拉... ,柏拉图,哲学&柏拉图&理想国&古希腊&经典&政治学&外国文学&学术,商务印书馆
https://book.douban.com/subject/3669381/,https://img1.doubanio.com/view/subject/s/public/s3767709.jpg,坏世界研究,作为第一哲学的政治哲学,8.7,741人,赵汀阳 / 中国人民大学出版社 / 2009-04-01 / 39.00,《坏世界研究:作为第一哲学的政治哲学》讨论了决定人们命运的制度、自由、权利和权力，这《坏世界研究:作为第一哲学的政治哲学》揭示了治国、治人、治事的秘密、策略... ,赵汀阳,政治哲学&赵汀阳&哲学&政治&政治学&世界观&思考&历史,中国人民大学出版社
https://book.douban.com/subject/27098940/,https://img9.doubanio.com/view/subject/s/public/s29624444.jpg,意识形态的崇高客体, ,9.4,505人,[斯洛文尼亚] 斯拉沃热·齐泽克 / 季广茂 / 中央编译出版社 / 2017-7-1 / 70.00元,《意识形态的崇高客体(第二版)》介绍从泰坦尼克号的沉没到希区柯克的影片，从瓦格纳的歌剧到海因莱因的科幻，从拉康到福柯，从黑格尔到马克思，从重大政治事件到犹太... ,斯拉沃热·齐泽克,齐泽克&哲学&意识形态&政治哲学&文化研究&政治学&东欧&欲购,中央编译出版社
https://book.douban.com/subject/1032063/,https://img9.doubanio.com/view/subject/s/public/s1076506.jpg,旧制度与大革命, ,8.9,9834人,[法] 托克维尔 / 冯棠 / 商务印书馆 / 1992-08 / 12.80元,该书是十九世纪法国著名思想家、社会学家、历史学家托克维尔（1805—1859）的代表作，是现代政治学、社会学和历史学的一部划时代的经典。书中主要讨论十八世纪... ,托克维尔,托克维尔&历史&法国大革命&政治学&政治&社会思想&法国&制度,商务印书馆
https://book.douban.com/subject/27025626/,https://img2.doubanio.com/view/subject/s/public/s29431271.jpg,君主论,拿破仑批注版,8.9,1300人,(意) 马基雅维利 / 刘训练 / 中央编译出版社 / 2017-4 / 58.00,1815年6月18日，有人在拿破仑•波拿巴的马车座驾中发现了一些书籍文件，其中包括一份手稿……让人喜出望外的是，这份手稿不仅是《君主论》的新译本，而且页边还... ,马基雅维利,马基雅维利&政治学&政治哲学&政治&拿破仑&社会学&政治社会学&思想史,中央编译出版社
https://book.douban.com/subject/1028268/,https://img9.doubanio.com/view/subject/s/public/s1271996.jpg,正义论, ,8.9,2955人,[美] 约翰·罗尔斯 / 何怀宏、何包钢、廖申白 / 中国社会科学出版社 / 2001-6 / 32.00元,自由主义中的保守派只能接受形式上的平等，也就是法律面前人人平等的原则；而自由平等主义者则表现出对于实质平等的强烈关怀。罗尔斯在《正义论》当中提出了关于正义的... ,约翰·罗尔斯,政治哲学&罗尔斯&哲学&正义论&政治学&伦理学&法学&正义,中国社会科学出版社
https://book.douban.com/subject/25908550/,https://img9.doubanio.com/view/subject/s/public/s29494856.jpg,历史的终结与最后的人, ,8.4,3525人,[美] 弗朗西斯·福山 / 陈高华 译、孟凡礼 校 / 广西师范大学出版社 / 2014-9 / 78.00元,梁文道、刘瑜、熊培云、许知远联袂主编——“理想国译丛”（MIRROR）系列之一（004）——保持开放性的思想和非功利的眼睛，看看世界的丰富性与复杂性。本书有... ,弗朗西斯·福山,政治学&政治哲学&弗朗西斯·福山&福山&历史&历史哲学&社会学&政治,广西师范大学出版社
https://book.douban.com/subject/1070007/,https://img2.doubanio.com/view/subject/s/public/s4420841.jpg,致命的自负,社会主义的谬误,8.8,3496人,[英] 哈耶克 / 冯克利、胡晋华 / 中国社会科学出版社 / 2000-09 / 19.80,1978年，年届80高龄，与形形色色的社会主义战斗了一生的哈耶克，希望让这场论战有个了断。他设想举行一次正式的大辩论，地点很可能是在巴黎，让社会主义的主要理... ,哈耶克,哈耶克&自由主义&经济学&哲学&政治学&社会学&政治&经济,中国社会科学出版社
https://book.douban.com/subject/35518114/,https://img9.doubanio.com/view/subject/s/public/s33979736.jpg,政治学有什么用？, ,8.3,166人,[英]加雷思·索思韦尔 / 姚子玄 / 译林出版社 / 2021-9 / 48.00元,暂无,加雷思·索思韦尔,政治学&通识&政治&政治哲学&科普&英国&Politics&历史,译林出版社
https://book.douban.com/subject/3528067/,https://img3.doubanio.com/view/subject/s/public/s4080990.jpg,圣杯与剑,我们的历史，我们的未来,8.6,378人,理安·艾斯勒 (Riane Eisler) / 程志民 / 社会科学文献出版社 / 2009-1-1 / 49.00元,圣杯与剑，ISBN：9787509705872，作者：（美）艾斯勒 著，程志民 译 ,理安·艾斯勒,人类学&女性主义&女权主义&女性&社会学&性别&政治学&思想史,社会科学文献出版社
https://book.douban.com/subject/35256019/,https://img9.doubanio.com/view/subject/s/public/s33773565.jpg,规训革命,加尔文主义与近代早期欧洲国家的兴起,9.0,174人,[美]菲利普·S. 戈尔斯基 / 李钧鹏、李腾 / 北京师范大学出版社 / 2021-2-15 / 79.00元,作为一项比较历史社会学研究，本书将历史个案并置比较，以阐明和提炼关于宏观社会变化的理论观点。大多数比较历史社会学研究以国家为个案，本书却讲教派作为个案，在作... ,菲利普·S. 戈尔斯基,社会学&历史社会学&政治学&历史&宗教&社会理论&美国&新书记,北京师范大学出版社
https://book.douban.com/subject/35413833/,https://img1.doubanio.com/view/subject/s/public/s34033357.jpg,专制主义统治下的臣民心理, ,7.5,306人,谢天佑 / 广西师范大学出版社 / 2021-5-31 / 68.00元,暂无,谢天佑,历史&中国历史&政治文化&政治学&政治&历史学&心理&传统文化,广西师范大学出版社
https://book.douban.com/subject/25708550/,https://img3.doubanio.com/view/subject/s/public/s27057270.jpg,知识分子与社会, ,8.2,844人,[美] 托马斯·索维尔 / 张亚月、梁兴国 / 中信出版社 / 2013-8 / 68.00元,本书是反思及批判“公共知识分子”的社会学名著，也是研究当代思想史的重要参考资料。本书从观念、经济、社会、媒体、法律、战争等6个方面全面陈述了知识分子在社会发... ,托马斯·索维尔,社会学&知识分子&社会&政治&政治学&文化&美国,中信出版社
https://book.douban.com/subject/33436180/,https://img9.doubanio.com/view/subject/s/public/s33310036.jpg,牛津大学哲学通识课：政治哲学, ,9.3,1523人,[英] 乔纳森·沃尔夫（Jonathan Wolff） / 毛兴贵 / 中信出版社 / 2019-7 / 48.00,暂无,乔纳森·沃尔夫,政治哲学&哲学&政治学&政治&英国&导论&科普&导读,中信出版社
https://book.douban.com/subject/25844426/,https://img9.doubanio.com/view/subject/s/public/s27241106.jpg,反抗“平庸之恶”,《责任与判断》中文修订版,8.8,1044人,[美] 汉娜·阿伦特 / 陈联营 / 上海人民出版社 / 2014-4 / 39.00元,没有人比阿伦特更了解：20世纪的道德大崩溃，不是由于人的无知或邪恶，未能辨别道德“真相”，而是由于道德“真相”不足以作为标准，评判人们当下可能做出的事情。道... ,汉娜·阿伦特,汉娜·阿伦特&政治哲学&社会学&哲学&阿伦特&伦理学&政治学&社会理论,上海人民出版社
https://book.douban.com/subject/26378573/,https://img2.doubanio.com/view/subject/s/public/s28215642.jpg,经济人的末日,极权主义的起源,9.2,562人,[美] 彼得·德鲁克 / 洪世民、赵志恒 / 上海译文出版社 / 2015-8 / 35,暂无,彼得·德鲁克,极权主义&政治&彼得·德鲁克&政治学&经济学&经济&历史&政治哲学,上海译文出版社
https://book.douban.com/subject/30170661/,https://img9.doubanio.com/view/subject/s/public/s31459974.jpg,中国乡村,19世纪的帝国控制,9.4,343人,萧公权 / 张皓、张升 / 九州出版社 / 2018-2 / 158.00,暂无,萧公权,萧公权&社会学&历史&中国近代史&社会史&近代史&海外中国研究&清史,九州出版社
https://book.douban.com/subject/35496036/,https://img9.doubanio.com/view/subject/s/public/s33921716.jpg,蚂蚁社会,一段引人入胜的历史,9.0,85人,[德]尼尔斯·韦贝尔 / 王蕾 / 广东人民出版社 / 2021-7 / 78,暂无,尼尔斯·韦贝尔,社会学&文化研究&社科&政治学&乌托邦&德国&思维&社会,广东人民出版社
https://book.douban.com/subject/1048930/,https://img2.doubanio.com/view/subject/s/public/s1437692.jpg,联邦党人文集, ,9.0,3024人,汉密尔顿、杰伊、麦迪逊 / 程逢如 / 商务印书馆 / 1980 / 30.00元,本书作者为美国开国元勋汉密尔顿（1755或1757—1804）、杰伊（1745—1829）、麦迪逊（1751—1836）。其中，汉密尔顿为经济学家、政治哲学... ,汉密尔顿&杰伊&麦迪逊,美国&政治&政治学&宪法&政治哲学&民主&历史&自由主义,商务印书馆
https://book.douban.com/subject/1139359/,https://img9.doubanio.com/view/subject/s/public/s5731254.jpg,毛泽东选集 第四卷, ,9.2,2964人,毛泽东 / 人民出版社 / 1991 / 44.00元,《毛泽东选集》(第4卷)(精装)包括毛泽东在解放战争时期写的70篇著作。 ,毛泽东,毛泽东&毛泽东选集&政治&哲学&历史&马克思主义&经典&毛选,人民出版社
https://book.douban.com/subject/33411421/,https://img1.doubanio.com/view/subject/s/public/s33466459.jpg,东方学, ,9.2,507人,[美]  爱德华·W. 萨义德 / 王宇根 / 生活·读书·新知三联书店 / 2019-9 / 68.00元,《东方学》这本书与当代历史的动荡和喧腾是完全分不开的。在书中，我相应地强调无论是“东方”这一用语，还是“西方”这一概念都不具有本体论意义上的稳定性，二者都由... ,爱德华·W. 萨义德,萨义德&东方学&社会学&文化研究&政治学&哲学&文论&社會學,生活·读书·新知三联书店
https://book.douban.com/subject/6852927/,https://img1.doubanio.com/view/subject/s/public/s24400947.jpg,中国政治思想史, ,9.4,307人,萧公权 / 商务印书馆 / 2011-12 / 95.00元,《中国政治思想史》全书共分五编二十五章，七十余万字，所取政治文献的研究资料上自晚周，下迄辛亥革命，全文所论及古今学者六十余人，文献资料相当丰富。作者以政治学... ,萧公权,萧公权&政治思想史&思想史&政治学&历史&政治哲学&政治&中国历史,商务印书馆
https://book.douban.com/subject/6041368/,https://img9.doubanio.com/view/subject/s/public/s4692706.jpg,现代政治思想的基础（上、下卷）, ,9.4,219人,[英国] 昆廷·斯金纳 / 奚瑞森、亚方 / 译林出版社 / 2011-1 / 98.00元,本书共两卷，分别探讨了文艺复兴和宗教改革时期主要政治思想流派的思想渊源和政治主张，时间跨度自13世纪后期至16世纪末，是研究中世纪后期到现代早期西方政治思想... ,昆廷·斯金纳,政治哲学&政治学&政治思想史&思想史&斯金纳&剑桥学派&政治&哲学,译林出版社
https://book.douban.com/subject/2170983/,https://img9.doubanio.com/view/subject/s/public/s4595394.jpg,苏格拉底的申辩, ,9.1,2709人,[古希腊] 柏拉图 / 吴飞 译/疏 / 华夏出版社 / 2007-6 / 25.00元,《柏拉图注疏集:苏格拉底的申辩》记述的是公元前399年，一个叫莫勒图斯的年轻人在雅典状告哲学家苏格拉底，说他不信城邦诸神，引进新的精灵之事，败坏青年。于是，... ,柏拉图,哲学&苏格拉底&柏拉图&古希腊&西方哲学&政治哲学&政治学&吴飞,华夏出版社
https://book.douban.com/subject/35063946/,https://img9.doubanio.com/view/subject/s/public/s33787404.jpg,与时俱进的启蒙, ,9.0,96人,徐贲 / 上海三联书店 / 2021-1 / 98.00,本书通过对18世纪前后不同国家的启蒙运动的交叉比较分析，抽取出四对在后世有重要影响的核心观念：英国的自由与保守、法国的理性与革命、美国的制度与人性、德国的国... ,徐贲,思想史&徐贲&启蒙&政治学&哲学&思想&历史&2021,上海三联书店
https://book.douban.com/subject/35508423/,https://img2.doubanio.com/view/subject/s/public/s33959841.jpg,知识考古学, ,9.4,135人,[法] 米歇尔·福柯 / 董树宝 / 生活·读书·新知三联书店 / 2021-9 / 52.00元,暂无,米歇尔·福柯,福柯&哲学&社会学&社会理论&后现代&法国&政治学&社科,生活·读书·新知三联书店
https://book.douban.com/subject/1867208/,https://img9.doubanio.com/view/subject/s/public/s5745476.jpg,政治学,（第二版）,9.1,765人,[英]安德鲁·海伍德 Andrew Heywood / 张立鹏 / 中国人民大学出版社 / 2006-6 / 49.80元,《政治学》系统地阐述了政治学的理论及其发展脉络，内容涉及政治理论、民族与全球化、政治互动、政府机构、政策与绩效。作者将政治哲学与政治科学有机地勾连起来，梳理... ,安德鲁·海伍德 Andrew Heywood,政治学&政治&教材&政治科学&教科书&英国&政治哲学&Politics,中国人民大学出版社
https://book.douban.com/subject/26592899/,https://img9.doubanio.com/view/subject/s/public/s28291786.jpg,政治秩序与政治衰败,从工业革命到民主全球化,8.6,1378人,[美] 弗朗西斯·福山 / 毛俊杰 / 广西师范大学出版社 / 2015-9-1 / 98.00元,《政治秩序与政治衰败》是斯坦福大学政治学家弗朗西斯·福山的最新著作，是其上一卷《政治秩序的起源》的姊妹篇，作者在上一卷里将人类政治秩序的起源一直追溯到前人类... ,弗朗西斯·福山,政治学&政治哲学&弗朗西斯·福山&政治&福山&社会学&理想国译丛&历史,广西师范大学出版社
https://book.douban.com/subject/10571622/,https://img2.doubanio.com/view/subject/s/public/s10482672.jpg,知识分子的鸦片, ,8.8,763人,[法] 雷蒙·阿隆 / 吕一民、顾杭 / 译林出版社 / 2012-6 / 45.00元,"《 知识分子的鸦片》一书是雷蒙·阿隆在冷战初期,针对当时法国特别是法国知识界的情况而作的一本法国人反思法兰西病的著作。在  《 知识分子的鸦片》一书中,作者... ",雷蒙·阿隆,社会学&雷蒙·阿隆&知识分子&哲学&政治学&法国&文化研究&思想史,译林出版社
https://book.douban.com/subject/35664441/,https://img1.doubanio.com/view/subject/s/public/s34046297.jpg,政治、政党与压力集团, ,暂无,少于10人,"[美]小瓦尔迪默·奥兰多·基（Valdimer Orlando Key, Jr.） / 周艳辉、陈家刚 / 浙江人民出版社 / 2021-10 / 256.00元",本书是美国著名政治学者小瓦尔迪默•奥兰多•基研究美国政治、政党、选举和投票行为的经典之作。全书从四个方面对美国政党的类型和性质、政治规则的本质、压力集团构成... ,小瓦尔迪默·奥兰多·基,政治学&美国政治&研究方法&社科&新书记&收录目标&哲学,浙江人民出版社
https://book.douban.com/subject/10876715/,https://img2.doubanio.com/view/subject/s/public/s10479312.jpg,论法的精神,（上下卷）,8.9,1260人,[法]孟德斯鸠 / 许明龙 / 商务印书馆 / 2012-5 / 88.00元,作者阐述了自然法理论、法和法律定义，法律与政体关系，以及政体分类、各种政体的性质和原则等问题。阐述政治自由和三权分立学说，并以英国为例提出了君主立宪制的政治... ,孟德斯鸠,孟德斯鸠&法学&法律&哲学&法哲学&政治学&政治&经典,商务印书馆
https://book.douban.com/subject/26581737/,https://img9.doubanio.com/view/subject/s/public/s28372746.jpg,权力的毛细管作用,清代的思想、学术与心态,8.9,964人,王汎森 / 北京大学出版社 / 2015-9-1 / 95.00元,《权力的毛细管作用》聚焦于明清嬗代之际的思想史和学术史。全书分两部分，第一部分藉考察讲经会、省过会、日谱、人谱等面相，探讨明季清初道德意识的呈现方式及转化，... ,王汎森,思想史&王汎森&历史&明清史&社会学&政治学&社会史&政治,北京大学出版社
https://book.douban.com/subject/26278816/,https://img3.doubanio.com/view/subject/s/public/s33898400.jpg,耶鲁大学公开课 : 政治哲学, ,8.9,1168人,[美]史蒂芬·B·斯密什(Steven B. Smith) / 贺晴川 / 北京联合出版公司·后浪出版公司 / 2015-1 / 39.80元,暂无,史蒂芬·B·斯密什,政治哲学&哲学&政治学&政治&公开课&美国&入门&后浪,北京联合出版公司·后浪出版公司
